The score (after 0 games) is: jonnyb1169 0, lasse 0 (match to 3 points)

Match Information:
Date: 16/09/2023
Place: BackgammonGalaxy

Move number 1:  jonnyb1169 to play 53

 GNU Backgammon  Position ID: 4HPwATDgc/ABMA
                 Match ID   : MIBuAAAAAAAE
 +12-11-10--9--8--7-------6--5--4--3--2--1-+     O: jonnyb1169
 | X           O    |   | O              X |     0 points
 | X           O    |   | O              X |     Rolled 53
 | X           O    |   | O                |     
 | X                |   | O                |     
 | X                |   | O                |    
^|                  |BAR|                  |     3 points match (Cube: 1)
 | O                |   | X                |    
 | O                |   | X                |     
 | O           X    |   | X                |     
 | O           X    |   | X              O |     
 | O           X    |   | X              O |     0 points
 +13-14-15-16-17-18------19-20-21-22-23-24-+     X: lasse
Pip counts: O 167, X 167

* jonnyb1169 moves 8/3 6/3

Rolled 53:
*    1. Cubeful 1-ply    8/3 6/3                      Eq.: +0.086
       0.514 0.162 0.007 - 0.486 0.129 0.007
     2. Cubeful 1-ply    24/21 13/8                   Eq.: +0.036 (-0.050)
       0.507 0.138 0.007 - 0.493 0.129 0.005
     3. Cubeful 1-ply    24/16                        Eq.: +0.003 (-0.083)
       0.505 0.123 0.005 - 0.495 0.136 0.005
     4. Cubeful 1-ply    13/10 13/8                   Eq.: -0.017 (-0.104)
       0.493 0.150 0.008 - 0.507 0.144 0.009
     5. Cubeful 1-ply    13/5                         Eq.: -0.063 (-0.149)
       0.484 0.141 0.006 - 0.516 0.146 0.009


Move number 2:  lasse to play 44

 GNU Backgammon  Position ID: jGfwATDgc/ABMA
                 Match ID   : cAlyAAAAAAAE
 +13-14-15-16-17-18------19-20-21-22-23-24-+     O: jonnyb1169
 | X           O    |   | O        O     X |     0 points
 | X           O    |   | O        O     X |     
 | X                |   | O                |     
 | X                |   | O                |     
 | X                |   |                  |    
v|                  |BAR|                  |     3 points match (Cube: 1)
 | O                |   | X                |    
 | O                |   | X                |     
 | O           X    |   | X                |     
 | O           X    |   | X              O |     Rolled 44
 | O           X    |   | X              O |     0 points
 +12-11-10--9--8--7-------6--5--4--3--2--1-+     X: lasse
Pip counts: O 159, X 167

* lasse moves 24/20(2) 13/9(2)

Cube analysis
1-ply cubeless equity -0.078 (Money: -0.060)
  0.486 0.129 0.007 - 0.514 0.162 0.007
Cubeful equities:
1. No double           -0.086
2. Double, pass        +1.000  (+1.086)
3. Double, take        -0.536  (-0.450)
Proper cube action: No double, take (29.3%)

Rolled 44:
*    1. Cubeful 1-ply    24/20(2) 13/9(2)             Eq.: +0.370
       0.580 0.152 0.005 - 0.420 0.070 0.001
     2. Cubeful 1-ply    24/20(2) 6/2(2)              Eq.: +0.236 (-0.134)
       0.548 0.141 0.005 - 0.452 0.082 0.001
     3. Cubeful 1-ply    24/20(2) 8/4(2)              Eq.: +0.232 (-0.138)
       0.544 0.151 0.005 - 0.456 0.085 0.002
     4. Cubeful 1-ply    13/5(2)                      Eq.: +0.204 (-0.166)
       0.541 0.185 0.009 - 0.459 0.136 0.007
     5. Cubeful 1-ply    24/16(2)                     Eq.: +0.163 (-0.207)
       0.548 0.099 0.003 - 0.452 0.100 0.002


Move number 3:  jonnyb1169 to play 63

 GNU Backgammon  Position ID: 4HPDAQOMZ/ABMA
                 Match ID   : MAFvAAAAAAAE
 +12-11-10--9--8--7-------6--5--4--3--2--1-+     O: jonnyb1169
 | X           O    |   | O  X     O       |     0 points
 | X           O    |   | O  X     O       |     Rolled 63
 | X                |   | O                |     
 |                  |   | O                |     
 |                  |   |                  |    
^|                  |BAR|                  |     3 points match (Cube: 1)
 | O                |   | X                |    
 | O                |   | X                |     
 | O           X    |   | X                |     
 | O        X  X    |   | X              O |     
 | O        X  X    |   | X              O |     0 points
 +13-14-15-16-17-18------19-20-21-22-23-24-+     X: lasse
Pip counts: O 159, X 151

* jonnyb1169 moves 24/15

Cube analysis
1-ply cubeless equity -0.295 (Money: -0.246)
  0.420 0.070 0.001 - 0.580 0.152 0.005
Cubeful equities:
1. No double           -0.370
2. Double, pass        +1.000  (+1.370)
3. Double, take        -1.064  (-0.694)
Proper cube action: No double, take (33.6%)

Rolled 63:
*    1. Cubeful 1-ply    24/15                        Eq.: -0.402
       0.415 0.066 0.002 - 0.585 0.163 0.005
     2. Cubeful 1-ply    24/21 13/7                   Eq.: -0.411 (-0.009)
       0.411 0.076 0.002 - 0.589 0.168 0.007
     3. Cubeful 1-ply    24/18 13/10                  Eq.: -0.445 (-0.042)
       0.405 0.080 0.002 - 0.595 0.180 0.008
     4. Cubeful 1-ply    24/18 6/3                    Eq.: -0.451 (-0.048)
       0.406 0.068 0.002 - 0.594 0.177 0.007
     5. Cubeful 1-ply    24/21 24/18                  Eq.: -0.480 (-0.077)
       0.403 0.068 0.003 - 0.597 0.192 0.006


Move number 4:  lasse to play 53

 GNU Backgammon  Position ID: jGfwCSDgc8MBAw
                 Match ID   : cIluAAAAAAAE
 +13-14-15-16-17-18------19-20-21-22-23-24-+     O: jonnyb1169
 | X           O    |   | O  X     O       |     0 points
 | X           O    |   | O  X     O       |     
 | X                |   | O                |     
 |                  |   | O                |     
 |                  |   |                  |    
v|                  |BAR|                  |     3 points match (Cube: 1)
 | O                |   | X                |    
 | O                |   | X                |     
 | O           X    |   | X                |     
 | O        X  X    |   | X                |     Rolled 53
 | O     O  X  X    |   | X              O |     0 points
 +12-11-10--9--8--7-------6--5--4--3--2--1-+     X: lasse
Pip counts: O 150, X 151

* lasse moves 13/10* 6/1*

Cube analysis
1-ply cubeless equity +0.327 (Money: +0.270)
  0.585 0.163 0.005 - 0.415 0.066 0.002
Cubeful equities:
1. No double           +0.402
2. Double, pass        +1.000  (+0.598)
3. Double, take        +0.244  (-0.158)
Proper cube action: No double, take (21.0%)

Rolled 53:
*    1. Cubeful 1-ply    13/10* 6/1*                  Eq.: +0.403
       0.578 0.183 0.006 - 0.422 0.085 0.002
     2. Cubeful 1-ply    8/3 6/3                      Eq.: +0.355 (-0.048)
       0.570 0.158 0.004 - 0.430 0.060 0.001
     3. Cubeful 1-ply    13/10* 13/8                  Eq.: +0.286 (-0.117)
       0.557 0.154 0.007 - 0.443 0.081 0.002
     4. Cubeful 1-ply    13/10*/5                     Eq.: +0.281 (-0.122)
       0.552 0.159 0.007 - 0.448 0.085 0.002
     5. Cubeful 1-ply    20/15 13/10*                 Eq.: +0.189 (-0.214)
       0.549 0.148 0.007 - 0.451 0.135 0.005


Move number 5:  jonnyb1169 to play 62

 GNU Backgammon  Position ID: wXOLAQOMZ/ABYA
                 Match ID   : MAFrAAAAAAAE
 +12-11-10--9--8--7-------6--5--4--3--2--1-+     O: jonnyb1169
 | X           O    | O | O  X     O       |     0 points
 | X           O    | O | O  X     O       |     Rolled 62
 |                  |   | O                |     
 |                  |   | O                |     
 |                  |   |                  |    
^|                  |BAR|                  |     3 points match (Cube: 1)
 | O                |   |                  |    
 | O                |   | X                |     
 | O           X    |   | X                |     
 | O        X  X    |   | X                |     
 | O     X  X  X    |   | X              X |     0 points
 +13-14-15-16-17-18------19-20-21-22-23-24-+     X: lasse
Pip counts: O 161, X 143

* jonnyb1169 moves bar/23

Cube analysis
1-ply cubeless equity -0.316 (Money: -0.258)
  0.422 0.085 0.002 - 0.578 0.183 0.006
Cubeful equities:
1. No double           -0.403
2. Double, pass        +1.000  (+1.403)
3. Double, take        -1.052  (-0.649)
Proper cube action: No double, take (31.6%)

Rolled 62:
*    1. Cubeful 0-ply    bar/23                       Eq.: -0.687
       0.370 0.074 0.002 - 0.630 0.237 0.008


Move number 6:  lasse on roll, cube decision?

 GNU Backgammon  Position ID: jGfwAUjBc4sBAw
                 Match ID   : cAlgAAAAAAAE
 +13-14-15-16-17-18------19-20-21-22-23-24-+     O: jonnyb1169
 | X           O    | O | O  X     O       |     0 points
 | X           O    |   | O  X     O       |     
 |                  |   | O                |     
 |                  |   | O                |     
 |                  |   |                  |    
v|                  |BAR|                  |     3 points match (Cube: 1)
 | O                |   |                  |    
 | O                |   | X                |     
 | O           X    |   | X                |     
 | O        X  X    |   | X                |     On roll
 | O     X  X  X    |   | X           O  X |     0 points
 +12-11-10--9--8--7-------6--5--4--3--2--1-+     X: lasse
Pip counts: O 159, X 143

* lasse doubles


Cube analysis
1-ply cubeless equity +0.519 (Money: +0.423)
  0.626 0.235 0.008 - 0.374 0.069 0.002
Cubeful equities:
1. Double, take        +0.663
2. Double, pass        +1.000  (+0.337)
3. No double           +0.628  (-0.035)
Proper cube action: Double, take
Move number 7:  lasse doubles to 2

 GNU Backgammon  Position ID: jGfwAUjBc4sBAw
                 Match ID   : cBFgAAAAAAAE
 +13-14-15-16-17-18------19-20-21-22-23-24-+     O: jonnyb1169
 | X           O    | O | O  X     O       |     0 points
 | X           O    |   | O  X     O       |     Cube offered at 2
 |                  |   | O                |     
 |                  |   | O                |     
 |                  |   |                  |    
v|                  |BAR|                  |     
 | O                |   |                  |    
 | O                |   | X                |     
 | O           X    |   | X                |     
 | O        X  X    |   | X                |     
 | O     X  X  X    |   | X           O  X |     0 points
 +12-11-10--9--8--7-------6--5--4--3--2--1-+     X: lasse
Pip counts: O 159, X 143

* jonnyb1169 accepts


Cube analysis
1-ply cubeless equity -0.519 (Money: -0.423)
  0.374 0.069 0.002 - 0.626 0.235 0.008
Cubeful equities:
1. Double, take        -0.663
2. Double, pass        -1.000  (-0.337)
3. No double           -0.628  (+0.035)
Proper cube action: Double, take
Move number 8:  lasse to play 31

 GNU Backgammon  Position ID: jGfwAUjBc4sBAw
                 Match ID   : QYllAAAAAAAE
 +13-14-15-16-17-18------19-20-21-22-23-24-+     O: jonnyb1169 (Cube: 2)
 | X           O    | O | O  X     O       |     0 points
 | X           O    |   | O  X     O       |     
 |                  |   | O                |     
 |                  |   | O                |     
 |                  |   |                  |    
v|                  |BAR|                  |     3 points match
 | O                |   |                  |    
 | O                |   | X                |     
 | O           X    |   | X                |     
 | O        X  X    |   | X                |     Rolled 31
 | O     X  X  X    |   | X           O  X |     0 points
 +12-11-10--9--8--7-------6--5--4--3--2--1-+     X: lasse
Pip counts: O 159, X 143

* lasse moves 8/5 6/5

Rolled 31:
*    1. Cubeful 1-ply    8/5 6/5                      Eq.: +0.241
       0.628 0.206 0.008 - 0.372 0.075 0.002
     2. Cubeful 1-ply    10/7 8/7                     Eq.: +0.147 (-0.094)
       0.604 0.168 0.006 - 0.396 0.076 0.002
     3. Cubeful 1-ply    10/6                         Eq.: +0.005 (-0.236)
       0.557 0.144 0.005 - 0.443 0.083 0.002
     4. Cubeful 1-ply    13/9                         Eq.: +0.002 (-0.239)
       0.555 0.147 0.005 - 0.445 0.085 0.002
     5. Cubeful 1-ply    6/2*                         Eq.: -0.050 (-0.291)
       0.532 0.165 0.006 - 0.468 0.109 0.003


Move number 9:  jonnyb1169 to play 31

 GNU Backgammon  Position ID: YWeLAQOMZ/ABSA
                 Match ID   : AYFlAAAAAAAE
 +12-11-10--9--8--7-------6--5--4--3--2--1-+     O: jonnyb1169 (Cube: 2)
 | X           O    | O | O  X     O       |     0 points
 | X           O    |   | O  X     O       |     Rolled 31
 |                  |   | O                |     
 |                  |   | O                |     
 |                  |   |                  |    
^|                  |BAR|                  |     3 points match
 | O                |   |                  |    
 | O                |   |                  |     
 | O                |   | X                |     
 | O        X  X    |   | X  X             |     
 | O     X  X  X    |   | X  X        O  X |     0 points
 +13-14-15-16-17-18------19-20-21-22-23-24-+     X: lasse
Pip counts: O 159, X 139

* jonnyb1169 moves bar/24*/21

Cube analysis
1-ply cubeless equity -0.385 (Money: -0.392)
  0.372 0.075 0.002 - 0.628 0.206 0.008
Cubeful equities:
1. No double           -0.241
2. Double, pass        +1.000  (+1.241)
3. Double, take        -0.509  (-0.268)
Proper cube action: No redouble, take (17.8%)

Rolled 31:
*    1. Cubeful 1-ply    bar/24*/21                   Eq.: -0.111
       0.412 0.091 0.003 - 0.588 0.179 0.009
     2. Cubeful 1-ply    bar/24* 13/10                Eq.: -0.169 (-0.058)
       0.391 0.090 0.003 - 0.609 0.184 0.012
     3. Cubeful 1-ply    bar/24* 6/3                  Eq.: -0.190 (-0.079)
       0.384 0.082 0.003 - 0.616 0.184 0.010
     4. Cubeful 1-ply    bar/22 23/22                 Eq.: -0.233 (-0.121)
       0.349 0.054 0.001 - 0.651 0.121 0.003
     5. Cubeful 1-ply    bar/21                       Eq.: -0.387 (-0.276)
       0.341 0.063 0.002 - 0.659 0.276 0.010


Move number 10:  lasse to play 41

 GNU Backgammon  Position ID: jGfwARKws8WAQQ
                 Match ID   : QQlmAAAAAAAE
 +13-14-15-16-17-18------19-20-21-22-23-24-+     O: jonnyb1169 (Cube: 2)
 | X           O    |   | O  X     O       |     0 points
 | X           O    |   | O  X     O       |     
 |                  |   | O                |     
 |                  |   | O                |     
 |                  |   |                  |    
v|                  |BAR|                  |     3 points match
 | O                |   |                  |    
 | O                |   |                  |     
 | O                |   | X                |     
 | O        X  X    |   | X  X             |     Rolled 41
 | O     X  X  X    | X | X  X  O     O    |     0 points
 +12-11-10--9--8--7-------6--5--4--3--2--1-+     X: lasse
Pip counts: O 155, X 163

* lasse moves bar/21 10/9

Rolled 41:
     1. Cubeful 1-ply    bar/24 10/6                  Eq.: +0.098
       0.583 0.176 0.006 - 0.417 0.082 0.002
*    2. Cubeful 1-ply    bar/21 10/9                  Eq.: +0.096 (-0.002)
       0.588 0.154 0.005 - 0.412 0.076 0.001
     3. Cubeful 1-ply    bar/20                       Eq.: +0.042 (-0.056)
       0.571 0.145 0.005 - 0.429 0.083 0.002
     4. Cubeful 1-ply    bar/21 6/5                   Eq.: +0.015 (-0.083)
       0.561 0.149 0.005 - 0.439 0.095 0.002
     5. Cubeful 1-ply    bar/24 6/2*                  Eq.: -0.042 (-0.140)
       0.539 0.156 0.006 - 0.461 0.122 0.005


Move number 11:  jonnyb1169 to play 65

 GNU Backgammon  Position ID: sLPDgAWMZ/ABEg
                 Match ID   : AQF3AAAAAAAE
 +12-11-10--9--8--7-------6--5--4--3--2--1-+     O: jonnyb1169 (Cube: 2)
 | X           O    |   | O  X  X  O       |     0 points
 | X           O    |   | O  X     O       |     Rolled 65
 |                  |   | O                |     
 |                  |   | O                |     
 |                  |   |                  |    
^|                  |BAR|                  |     3 points match
 | O                |   |                  |    
 | O                |   |                  |     
 | O        X       |   | X                |     
 | O        X  X    |   | X  X             |     
 | O        X  X    |   | X  X  O     O    |     0 points
 +13-14-15-16-17-18------19-20-21-22-23-24-+     X: lasse
Pip counts: O 155, X 158

* jonnyb1169 moves 21/15 13/8

Cube analysis
1-ply cubeless equity -0.254 (Money: -0.258)
  0.412 0.076 0.001 - 0.588 0.154 0.005
Cubeful equities:
1. No double           -0.096
2. Double, pass        +1.000  (+1.096)
3. Double, take        -0.352  (-0.256)
Proper cube action: No redouble, take (18.9%)

Rolled 65:
*    1. Cubeful 1-ply    21/15 13/8                   Eq.: -0.161
       0.395 0.079 0.002 - 0.605 0.180 0.007
     2. Cubeful 1-ply    23/18 21/15                  Eq.: -0.207 (-0.046)
       0.388 0.072 0.002 - 0.612 0.212 0.008
     3. Cubeful 1-ply    21/10                        Eq.: -0.222 (-0.061)
       0.375 0.073 0.002 - 0.625 0.190 0.007
     4. Cubeful 1-ply    13/2                         Eq.: -0.262 (-0.101)
       0.363 0.084 0.003 - 0.637 0.206 0.010
     5. Cubeful 1-ply    21/15 6/1                    Eq.: -0.298 (-0.137)
       0.355 0.070 0.002 - 0.645 0.218 0.010


Move number 12:  lasse to play 53

 GNU Backgammon  Position ID: jOfgCRCws8OABQ
                 Match ID   : QYluAAAAAAAE
 +13-14-15-16-17-18------19-20-21-22-23-24-+     O: jonnyb1169 (Cube: 2)
 | X           O    |   | O  X  X  O       |     0 points
 | X           O    |   | O  X     O       |     
 |             O    |   | O                |     
 |                  |   | O                |     
 |                  |   |                  |    
v|                  |BAR|                  |     3 points match
 |                  |   |                  |    
 | O                |   |                  |     
 | O        X       |   | X                |     
 | O        X  X    |   | X  X             |     Rolled 53
 | O     O  X  X    |   | X  X        O    |     0 points
 +12-11-10--9--8--7-------6--5--4--3--2--1-+     X: lasse
Pip counts: O 144, X 158

* lasse moves 13/10* 13/8

Rolled 53:
     1. Cubeful 1-ply    21/16 13/10*                 Eq.: +0.261
       0.639 0.195 0.007 - 0.361 0.079 0.002
*    2. Cubeful 1-ply    13/10* 13/8                  Eq.: +0.240 (-0.021)
       0.627 0.204 0.008 - 0.373 0.074 0.002
     3. Cubeful 1-ply    13/10*/5                     Eq.: +0.189 (-0.071)
       0.607 0.210 0.008 - 0.393 0.084 0.002
     4. Cubeful 1-ply    20/15 13/10*                 Eq.: +0.114 (-0.147)
       0.592 0.182 0.007 - 0.408 0.127 0.008
     5. Cubeful 1-ply    13/10* 9/4                   Eq.: +0.082 (-0.179)
       0.576 0.192 0.007 - 0.424 0.125 0.005


Move number 13:  jonnyb1169 to play 53

 GNU Backgammon  Position ID: sHMXgAWM5+ABSA
                 Match ID   : AYFuAAAAAAAE
 +12-11-10--9--8--7-------6--5--4--3--2--1-+     O: jonnyb1169 (Cube: 2)
 |             O    | O | O  X  X  O       |     0 points
 |             O    |   | O  X     O       |     Rolled 53
 |             O    |   | O                |     
 |                  |   | O                |     
 |                  |   |                  |    
^|                  |BAR|                  |     3 points match
 |                  |   |                  |    
 | O                |   |                  |     
 | O        X  X    |   | X                |     
 | O        X  X    |   | X  X             |     
 | O     X  X  X    |   | X  X        O    |     0 points
 +13-14-15-16-17-18------19-20-21-22-23-24-+     X: lasse
Pip counts: O 154, X 150

* jonnyb1169 moves bar/22 13/8

Cube analysis
1-ply cubeless equity -0.385 (Money: -0.392)
  0.373 0.074 0.002 - 0.627 0.204 0.008
Cubeful equities:
1. No double           -0.240
2. Double, pass        +1.000  (+1.240)
3. Double, take        -0.508  (-0.268)
Proper cube action: No redouble, take (17.8%)

Rolled 53:
*    1. Cubeful 1-ply    bar/22 13/8                  Eq.: -0.347
       0.340 0.063 0.002 - 0.660 0.226 0.008
     2. Cubeful 1-ply    bar/22 23/18                 Eq.: -0.360 (-0.014)
       0.346 0.068 0.003 - 0.654 0.264 0.010
     3. Cubeful 1-ply    bar/22 8/3                   Eq.: -0.408 (-0.061)
       0.321 0.062 0.002 - 0.679 0.242 0.010
     4. Cubeful 1-ply    bar/22 6/1                   Eq.: -0.435 (-0.088)
       0.315 0.058 0.001 - 0.685 0.253 0.010


Move number 14:  lasse to play 52

 GNU Backgammon  Position ID: jOfBARSwcxeABQ
                 Match ID   : QYlqAAAAAAAE
 +13-14-15-16-17-18------19-20-21-22-23-24-+     O: jonnyb1169 (Cube: 2)
 |             O    |   | O  X  X  O       |     0 points
 |             O    |   | O  X     O       |     
 |             O    |   | O                |     
 |             O    |   | O                |     
 |                  |   |                  |    
v|                  |BAR|                  |     3 points match
 |                  |   |                  |    
 |                  |   |                  |     
 | O        X  X    |   | X                |     
 | O        X  X    |   | X  X             |     Rolled 52
 | O     X  X  X    |   | X  X     O  O    |     0 points
 +12-11-10--9--8--7-------6--5--4--3--2--1-+     X: lasse
Pip counts: O 146, X 150

* lasse moves 9/4 6/4

Rolled 52:
*    1. Cubeful 1-ply    9/4 6/4                      Eq.: +0.278
       0.648 0.186 0.008 - 0.352 0.066 0.002
     2. Cubeful 1-ply    21/16 10/8                   Eq.: +0.216 (-0.062)
       0.629 0.170 0.006 - 0.371 0.064 0.001
     3. Cubeful 1-ply    21/14                        Eq.: +0.161 (-0.117)
       0.611 0.160 0.005 - 0.389 0.072 0.002
     4. Cubeful 1-ply    21/16 8/6                    Eq.: +0.127 (-0.151)
       0.593 0.178 0.006 - 0.407 0.081 0.002
     5. Cubeful 1-ply    10/3*                        Eq.: +0.119 (-0.159)
       0.586 0.193 0.006 - 0.414 0.092 0.002


Move number 15:  jonnyb1169 to play 41

 GNU Backgammon  Position ID: 2OYWgAWM58EBFA
                 Match ID   : AQFmAAAAAAAE
 +12-11-10--9--8--7-------6--5--4--3--2--1-+     O: jonnyb1169 (Cube: 2)
 |             O    |   | O  X  X  O       |     0 points
 |             O    |   | O  X     O       |     Rolled 41
 |             O    |   | O                |     
 |             O    |   | O                |     
 |                  |   |                  |    
^|                  |BAR|                  |     3 points match
 |                  |   |                  |    
 |                  |   |                  |     
 | O           X    |   |                  |     
 | O        X  X    |   | X  X  X          |     
 | O     X  X  X    |   | X  X  X  O  O    |     0 points
 +13-14-15-16-17-18------19-20-21-22-23-24-+     X: lasse
Pip counts: O 146, X 143

* jonnyb1169 moves 23/22 8/4*

Cube analysis
1-ply cubeless equity -0.415 (Money: -0.421)
  0.352 0.066 0.002 - 0.648 0.186 0.008
Cubeful equities:
1. No double           -0.278
2. Double, pass        +1.000  (+1.278)
3. Double, take        -0.589  (-0.311)
Proper cube action: No redouble, take (19.6%)

Rolled 41:
*    1. Cubeful 1-ply    23/22 8/4*                   Eq.: -0.332
       0.319 0.051 0.001 - 0.681 0.147 0.006
     2. Cubeful 1-ply    23/22 6/2                    Eq.: -0.351 (-0.019)
       0.303 0.046 0.001 - 0.697 0.121 0.003
     3. Cubeful 1-ply    8/4*/3                       Eq.: -0.358 (-0.026)
       0.333 0.069 0.002 - 0.667 0.222 0.008
     4. Cubeful 1-ply    13/12 8/4*                   Eq.: -0.456 (-0.125)
       0.314 0.071 0.003 - 0.686 0.278 0.018
     5. Cubeful 1-ply    23/22 13/9                   Eq.: -0.476 (-0.144)
       0.266 0.040 0.002 - 0.734 0.153 0.006


Move number 16:  lasse to play 65

 GNU Backgammon  Position ID: LM/BAQzY5haAQQ
                 Match ID   : QQl3AAAAAAAE
 +13-14-15-16-17-18------19-20-21-22-23-24-+     O: jonnyb1169 (Cube: 2)
 |             O    |   | O  X  O  O       |     0 points
 |             O    |   | O  X     O       |     
 |             O    |   | O                |     
 |                  |   | O                |     
 |                  |   |                  |    
v|                  |BAR|                  |     3 points match
 |                  |   |                  |    
 |                  |   |                  |     
 | O           X    |   |                  |     
 | O        X  X    |   | X  X  X  O       |     Rolled 65
 | O     X  X  X    | X | X  X  X  O       |     0 points
 +12-11-10--9--8--7-------6--5--4--3--2--1-+     X: lasse
Pip counts: O 141, X 147

* lasse moves bar/14

Rolled 65:
*    1. Cubeful 1-ply    bar/14                       Eq.: +0.291
       0.677 0.111 0.003 - 0.323 0.052 0.001
     2. Cubeful 1-ply    bar/20 10/4                  Eq.: +0.206 (-0.085)
       0.644 0.109 0.002 - 0.356 0.055 0.001
     3. Cubeful 1-ply    bar/20 8/2                   Eq.: +0.171 (-0.120)
       0.629 0.119 0.003 - 0.371 0.065 0.001


Move number 17:  jonnyb1169 to play 53

 GNU Backgammon  Position ID: 2OYWAgMsz8EBDA
                 Match ID   : AYFuAAAAAAAE
 +12-11-10--9--8--7-------6--5--4--3--2--1-+     O: jonnyb1169 (Cube: 2)
 |    X        O    |   | O  X  O  O       |     0 points
 |             O    |   | O  X     O       |     Rolled 53
 |             O    |   | O                |     
 |                  |   | O                |     
 |                  |   |                  |    
^|                  |BAR|                  |     3 points match
 |                  |   |                  |    
 |                  |   |                  |     
 | O           X    |   |                  |     
 | O        X  X    |   | X  X  X  O       |     
 | O     X  X  X    |   | X  X  X  O       |     0 points
 +13-14-15-16-17-18------19-20-21-22-23-24-+     X: lasse
Pip counts: O 141, X 136

* jonnyb1169 moves 6/1 4/1

Cube analysis
1-ply cubeless equity -0.414 (Money: -0.416)
  0.323 0.052 0.001 - 0.677 0.111 0.003
Cubeful equities:
1. No double           -0.291
2. Double, pass        +1.000  (+1.291)
3. Double, take        -0.707  (-0.416)
Proper cube action: No redouble, take (24.4%)

Rolled 53:
*    1. Cubeful 1-ply    6/1 4/1                      Eq.: -0.361
       0.299 0.040 0.001 - 0.701 0.120 0.003
     2. Cubeful 1-ply    13/8 6/3                     Eq.: -0.376 (-0.015)
       0.289 0.036 0.001 - 0.711 0.106 0.003
     3. Cubeful 1-ply    13/8 4/1                     Eq.: -0.398 (-0.036)
       0.281 0.035 0.001 - 0.719 0.107 0.003
     4. Cubeful 1-ply    8/3 4/1                      Eq.: -0.403 (-0.042)
       0.282 0.035 0.001 - 0.718 0.116 0.003
     5. Cubeful 1-ply    6/3 6/1                      Eq.: -0.420 (-0.059)
       0.277 0.040 0.001 - 0.723 0.123 0.003


Move number 18:  lasse to play 33

 GNU Backgammon  Position ID: M87BAQzY5hYCAw
                 Match ID   : QYltAAAAAAAE
 +13-14-15-16-17-18------19-20-21-22-23-24-+     O: jonnyb1169 (Cube: 2)
 |    X        O    |   | O  X     O     O |     0 points
 |             O    |   | O  X     O     O |     
 |             O    |   | O                |     
 |                  |   |                  |     
 |                  |   |                  |    
v|                  |BAR|                  |     3 points match
 |                  |   |                  |    
 |                  |   |                  |     
 | O           X    |   |                  |     
 | O        X  X    |   | X  X  X  O       |     Rolled 33
 | O     X  X  X    |   | X  X  X  O       |     0 points
 +12-11-10--9--8--7-------6--5--4--3--2--1-+     X: lasse
Pip counts: O 133, X 136

* lasse moves 14/5 10/7

Rolled 33:
     1. Cubeful 1-ply    14/11 10/4 8/5               Eq.: +0.276
       0.671 0.110 0.002 - 0.329 0.050 0.000
     2. Cubeful 1-ply    14/5 8/5                     Eq.: +0.275 (-0.001)
       0.670 0.114 0.003 - 0.330 0.051 0.000
     3. Cubeful 1-ply    14/8 10/4                    Eq.: +0.275 (-0.001)
       0.671 0.109 0.002 - 0.329 0.049 0.000
*    4. Cubeful 1-ply    14/5 10/7                    Eq.: +0.259 (-0.017)
       0.657 0.136 0.003 - 0.343 0.058 0.001
     5. Cubeful 1-ply    14/2                         Eq.: +0.258 (-0.019)
       0.663 0.116 0.002 - 0.337 0.055 0.000


Move number 19:  jonnyb1169 to play 61

 GNU Backgammon  Position ID: 2K0bAAMzzsEBDA
                 Match ID   : AQFnAAAAAAAE
 +12-11-10--9--8--7-------6--5--4--3--2--1-+     O: jonnyb1169 (Cube: 2)
 |             O    |   | O  X     O     O |     0 points
 |             O    |   | O  X     O     O |     Rolled 61
 |             O    |   | O                |     
 |                  |   |                  |     
 |                  |   |                  |    
^|                  |BAR|                  |     3 points match
 |                  |   |                  |    
 |                  |   |                  |     
 | O           X    |   |    X             |     
 | O        X  X    |   | X  X  X  O       |     
 | O        X  X  X |   | X  X  X  O       |     0 points
 +13-14-15-16-17-18------19-20-21-22-23-24-+     X: lasse
Pip counts: O 133, X 124

* jonnyb1169 moves 13/7 8/7

Cube analysis
1-ply cubeless equity -0.392 (Money: -0.395)
  0.343 0.058 0.001 - 0.657 0.136 0.003
Cubeful equities:
1. No double           -0.259
2. Double, pass        +1.000  (+1.259)
3. Double, take        -0.627  (-0.368)
Proper cube action: No redouble, take (22.6%)

Rolled 61:
*    1. Cubeful 1-ply    13/7 8/7                     Eq.: -0.371
       0.296 0.041 0.000 - 0.704 0.122 0.003
     2. Cubeful 1-ply    13/6                         Eq.: -0.399 (-0.028)
       0.284 0.037 0.000 - 0.716 0.119 0.003
     3. Cubeful 1-ply    8/2 3/2                      Eq.: -0.422 (-0.051)
       0.279 0.037 0.000 - 0.721 0.130 0.003
     4. Cubeful 1-ply    13/12 8/2                    Eq.: -0.456 (-0.085)
       0.268 0.040 0.001 - 0.732 0.138 0.004
     5. Cubeful 1-ply    8/1                          Eq.: -0.491 (-0.120)
       0.256 0.029 0.000 - 0.744 0.140 0.003


Move number 20:  lasse to play 66

 GNU Backgammon  Position ID: M26DAQzYrRsAAw
                 Match ID   : QQl7AAAAAAAE
 +13-14-15-16-17-18------19-20-21-22-23-24-+     O: jonnyb1169 (Cube: 2)
 |             O  O |   | O  X     O     O |     0 points
 |             O  O |   | O  X     O     O |     
 |                  |   | O                |     
 |                  |   |                  |     
 |                  |   |                  |    
v|                  |BAR|                  |     3 points match
 |                  |   |                  |    
 |                  |   |                  |     
 |             X    |   |    X             |     
 | O        X  X    |   | X  X  X  O       |     Rolled 66
 | O        X  X  X |   | X  X  X  O       |     0 points
 +12-11-10--9--8--7-------6--5--4--3--2--1-+     X: lasse
Pip counts: O 126, X 124

* lasse moves 20/14(2) 8/2 7/1

Rolled 66:
*    1. Cubeful 1-ply    20/14(2) 8/2 7/1             Eq.: +0.430
       0.748 0.060 0.001 - 0.252 0.023 0.000
     2. Cubeful 1-ply    20/8(2)                      Eq.: +0.401 (-0.029)
       0.732 0.079 0.003 - 0.268 0.036 0.001
     3. Cubeful 1-ply    20/8 20/14 7/1               Eq.: +0.359 (-0.070)
       0.719 0.066 0.002 - 0.281 0.034 0.001
     4. Cubeful 1-ply    20/14(2) 8/2(2)              Eq.: +0.205 (-0.225)
       0.637 0.151 0.006 - 0.363 0.101 0.002
     5. Cubeful 1-ply    20/2 7/1                     Eq.: +0.175 (-0.255)
       0.624 0.142 0.007 - 0.376 0.073 0.002


Move number 21:  jonnyb1169 to play 22

 GNU Backgammon  Position ID: ZTcbDAAzboMBDA
                 Match ID   : AQFpAAAAAAAE
 +12-11-10--9--8--7-------6--5--4--3--2--1-+     O: jonnyb1169 (Cube: 2)
 |    X        O  O |   | O        O     O |     0 points
 |    X        O  O |   | O        O     O |     Rolled 22
 |                  |   | O                |     
 |                  |   |                  |     
 |                  |   |                  |    
^|                  |BAR|                  |     3 points match
 |                  |   |                  |    
 |                  |   |                  |     
 |                  |   |    X             |     
 | O        X  X    |   | X  X  X  O       |     
 | O        X  X    |   | X  X  X  O  X  X |     0 points
 +13-14-15-16-17-18------19-20-21-22-23-24-+     X: lasse
Pip counts: O 126, X 100

* jonnyb1169 moves 8/4 7/5(2)

Cube analysis
1-ply cubeless equity -0.532 (Money: -0.533)
  0.252 0.023 0.000 - 0.748 0.060 0.001
Cubeful equities:
1. No double           -0.430
2. Double, pass        +1.000  (+1.430)
3. Double, take        -0.989  (-0.559)
Proper cube action: No redouble, take (28.1%)

Rolled 22:
*    1. Cubeful 1-ply    8/4 7/5(2)                   Eq.: -0.412
       0.257 0.024 0.000 - 0.743 0.055 0.001
     2. Cubeful 1-ply    8/4 7/5 6/4                  Eq.: -0.428 (-0.016)
       0.251 0.023 0.000 - 0.749 0.056 0.001
     3. Cubeful 1-ply    8/4(2)                       Eq.: -0.440 (-0.028)
       0.246 0.022 0.000 - 0.754 0.056 0.001
     4. Cubeful 1-ply    7/5(2) 6/4(2)                Eq.: -0.441 (-0.029)
       0.247 0.022 0.000 - 0.753 0.058 0.001
     5. Cubeful 1-ply    7/5(2) 6/2                   Eq.: -0.454 (-0.042)
       0.243 0.022 0.000 - 0.757 0.061 0.001


Move number 22:  lasse to play 31

 GNU Backgammon  Position ID: s3aCAQxlNxsMAA
                 Match ID   : QYllAAAAAAAE
 +13-14-15-16-17-18------19-20-21-22-23-24-+     O: jonnyb1169 (Cube: 2)
 |    X        O    |   | O  O  O  O     O |     0 points
 |    X             |   | O  O     O     O |     
 |                  |   | O                |     
 |                  |   |                  |     
 |                  |   |                  |    
v|                  |BAR|                  |     3 points match
 |                  |   |                  |    
 |                  |   |                  |     
 |                  |   |    X             |     
 | O        X  X    |   | X  X  X  O       |     Rolled 31
 | O        X  X    |   | X  X  X  O  X  X |     0 points
 +12-11-10--9--8--7-------6--5--4--3--2--1-+     X: lasse
Pip counts: O 118, X 100

* lasse moves 5/1

Rolled 31:
     1. Cubeful 1-ply    9/8 9/6                      Eq.: +0.392
       0.735 0.053 0.000 - 0.265 0.021 0.000
*    2. Cubeful 1-ply    5/1                          Eq.: +0.364 (-0.028)
       0.724 0.052 0.000 - 0.276 0.026 0.000
     3. Cubeful 1-ply    14/11 2/1                    Eq.: +0.260 (-0.132)
       0.679 0.076 0.002 - 0.321 0.060 0.001
     4. Cubeful 1-ply    14/11 5/4                    Eq.: +0.176 (-0.216)
       0.650 0.073 0.003 - 0.350 0.084 0.002
     5. Cubeful 1-ply    14/10                        Eq.: +0.169 (-0.223)
       0.646 0.081 0.004 - 0.354 0.088 0.002


Move number 23:  jonnyb1169 to play 61

 GNU Backgammon  Position ID: yzYbDACzdoIBDA
                 Match ID   : AQFnAAAAAAAE
 +12-11-10--9--8--7-------6--5--4--3--2--1-+     O: jonnyb1169 (Cube: 2)
 |    X        O    |   | O  O  O  O     O |     0 points
 |    X             |   | O  O     O     O |     Rolled 61
 |                  |   | O                |     
 |                  |   |                  |     
 |                  |   |                  |    
^|                  |BAR|                  |     3 points match
 |                  |   |                  |    
 |                  |   |                  |     
 |                  |   |                  |     
 | O        X  X    |   | X  X  X  O     X |     
 | O        X  X    |   | X  X  X  O  X  X |     0 points
 +13-14-15-16-17-18------19-20-21-22-23-24-+     X: lasse
Pip counts: O 118, X 96

* jonnyb1169 moves 8/2 4/3

Cube analysis
1-ply cubeless equity -0.475 (Money: -0.475)
  0.276 0.026 0.000 - 0.724 0.052 0.000
Cubeful equities:
1. No double           -0.364
2. Double, pass        +1.000  (+1.364)
3. Double, take        -0.895  (-0.532)
Proper cube action: No redouble, take (28.0%)
Alert: doubtful move ( -0.032)

Rolled 61:
     1. Cubeful 1-ply    8/2 6/5                      Eq.: -0.422
       0.257 0.025 0.000 - 0.743 0.065 0.001
     2. Cubeful 1-ply    8/2 3/2                      Eq.: -0.426 (-0.004)
       0.255 0.025 0.000 - 0.745 0.066 0.001
     3. Cubeful 1-ply    8/2 5/4                      Eq.: -0.432 (-0.010)
       0.253 0.024 0.000 - 0.747 0.065 0.001
*    4. Cubeful 1-ply    8/2 4/3                      Eq.: -0.455 (-0.032)
       0.245 0.022 0.000 - 0.755 0.067 0.001
     5. Cubeful 1-ply    13/12 13/7                   Eq.: -0.488 (-0.066)
       0.234 0.026 0.000 - 0.766 0.075 0.001


Move number 24:  lasse to play 31

 GNU Backgammon  Position ID: 6+yAAQzLNhsMAA
                 Match ID   : QYllAAAAAAAE
 +13-14-15-16-17-18------19-20-21-22-23-24-+     O: jonnyb1169 (Cube: 2)
 |    X             |   | O  O     O  O  O |     0 points
 |    X             |   | O  O     O     O |     
 |                  |   | O        O       |     
 |                  |   |                  |     
 |                  |   |                  |    
v|                  |BAR|                  |     3 points match
 |                  |   |                  |    
 |                  |   |                  |     
 |                  |   |                  |     
 | O        X  X    |   | X  X  X  O     X |     Rolled 31
 | O        X  X    |   | X  X  X  O  X  X |     0 points
 +12-11-10--9--8--7-------6--5--4--3--2--1-+     X: lasse
Pip counts: O 111, X 96

* lasse moves 9/8 9/6

Rolled 31:
*    1. Cubeful 1-ply    9/8 9/6                      Eq.: +0.439
       0.749 0.064 0.001 - 0.251 0.017 0.000
     2. Cubeful 1-ply    14/13 14/11                  Eq.: +0.323 (-0.116)
       0.698 0.092 0.003 - 0.302 0.055 0.001
     3. Cubeful 1-ply    14/10                        Eq.: +0.294 (-0.145)
       0.688 0.091 0.003 - 0.312 0.059 0.001
     4. Cubeful 1-ply    5/4 5/2                      Eq.: +0.270 (-0.169)
       0.687 0.053 0.001 - 0.313 0.028 0.000
     5. Cubeful 1-ply    14/11 2/1                    Eq.: +0.263 (-0.176)
       0.681 0.072 0.002 - 0.319 0.051 0.001


Move number 25:  jonnyb1169 to play 55

 GNU Backgammon  Position ID: y3YODADr7IABDA
                 Match ID   : AYF2AAAAAAAE
 +12-11-10--9--8--7-------6--5--4--3--2--1-+     O: jonnyb1169 (Cube: 2)
 |    X             |   | O  O     O  O  O |     0 points
 |    X             |   | O  O     O     O |     Rolled 55
 |                  |   | O        O       |     
 |                  |   |                  |     
 |                  |   |                  |    
^|                  |BAR|                  |     3 points match
 |                  |   |                  |    
 |                  |   |                  |     
 |             X    |   | X                |     
 | O           X    |   | X  X  X  O     X |     
 | O           X    |   | X  X  X  O  X  X |     0 points
 +13-14-15-16-17-18------19-20-21-22-23-24-+     X: lasse
Pip counts: O 111, X 92

* jonnyb1169 moves 13/3 13/8 6/1

Cube analysis
1-ply cubeless equity -0.545 (Money: -0.546)
  0.251 0.017 0.000 - 0.749 0.064 0.001
Cubeful equities:
1. No double           -0.439
2. Double, pass        +1.000  (+1.439)
3. Double, take        -0.994  (-0.555)
Proper cube action: No redouble, take (27.8%)

Rolled 55:
*    1. Cubeful 1-ply    13/3 13/8 6/1                Eq.: -0.501
       0.238 0.014 0.000 - 0.762 0.096 0.001
     2. Cubeful 1-ply    13/3(2)                      Eq.: -0.508 (-0.006)
       0.237 0.014 0.000 - 0.763 0.102 0.001
     3. Cubeful 1-ply    13/8(2) 6/1(2)               Eq.: -0.566 (-0.065)
       0.214 0.014 0.000 - 0.786 0.103 0.001
     4. Cubeful 1-ply    13/8 6/1(3)                  Eq.: -0.717 (-0.216)
       0.169 0.009 0.000 - 0.831 0.140 0.002
     5. Cubeful 1-ply    13/3 6/1(2)                  Eq.: -0.735 (-0.234)
       0.168 0.011 0.000 - 0.832 0.156 0.002


Move number 26:  lasse to play 42

 GNU Backgammon  Position ID: 17MJAAzLdg4MAA
                 Match ID   : QQlqAAAAAAAE
 +13-14-15-16-17-18------19-20-21-22-23-24-+     O: jonnyb1169 (Cube: 2)
 |    X        O    |   | O  O     O  O  O |     0 points
 |    X             |   | O  O     O     O |     
 |                  |   |          O     O |     
 |                  |   |          O       |     
 |                  |   |                  |    
v|                  |BAR|                  |     3 points match
 |                  |   |                  |    
 |                  |   |                  |     
 |             X    |   | X                |     
 |             X    |   | X  X  X  O     X |     Rolled 42
 |             X    |   | X  X  X  O  X  X |     0 points
 +12-11-10--9--8--7-------6--5--4--3--2--1-+     X: lasse
Pip counts: O 91, X 92

* lasse moves 8/2

Rolled 42:
*    1. Cubeful 1-ply    8/2                          Eq.: +0.461
       0.750 0.081 0.001 - 0.250 0.008 0.000
     2. Cubeful 1-ply    14/8                         Eq.: +0.456 (-0.006)
       0.747 0.085 0.002 - 0.253 0.011 0.000
     3. Cubeful 1-ply    14/12 6/2                    Eq.: +0.428 (-0.034)
       0.731 0.102 0.004 - 0.269 0.022 0.000
     4. Cubeful 1-ply    14/12 8/4                    Eq.: +0.425 (-0.036)
       0.732 0.100 0.004 - 0.268 0.025 0.000
     5. Cubeful 1-ply    14/10 8/6                    Eq.: +0.403 (-0.058)
       0.725 0.097 0.004 - 0.275 0.024 0.000


Move number 27:  jonnyb1169 to play 42

 GNU Backgammon  Position ID: m+0MDADXswkADA
                 Match ID   : AQFqAAAAAAAE
 +12-11-10--9--8--7-------6--5--4--3--2--1-+     O: jonnyb1169 (Cube: 2)
 |    X        O    |   | O  O     O  O  O |     0 points
 |    X             |   | O  O     O     O |     Rolled 42
 |                  |   |          O     O |     
 |                  |   |          O       |     
 |                  |   |                  |    
^|                  |BAR|                  |     3 points match
 |                  |   |                  |    
 |                  |   |                  |     
 |                  |   | X                |     
 |             X    |   | X  X  X  O  X  X |     
 |             X    |   | X  X  X  O  X  X |     0 points
 +13-14-15-16-17-18------19-20-21-22-23-24-+     X: lasse
Pip counts: O 91, X 86

* jonnyb1169 moves 8/2

Cube analysis
1-ply cubeless equity -0.573 (Money: -0.574)
  0.250 0.008 0.000 - 0.750 0.081 0.001
Cubeful equities:
1. No double           -0.461
2. Double, pass        +1.000  (+1.461)
3. Double, take        -0.997  (-0.536)
Proper cube action: No redouble, take (26.8%)

Rolled 42:
*    1. Cubeful 1-ply    8/2                          Eq.: -0.516
       0.227 0.011 0.000 - 0.773 0.081 0.000
     2. Cubeful 1-ply    6/2 3/1                      Eq.: -0.577 (-0.061)
       0.207 0.010 0.000 - 0.793 0.094 0.000
     3. Cubeful 1-ply    6/4 6/2                      Eq.: -0.583 (-0.067)
       0.208 0.010 0.000 - 0.792 0.104 0.000
     4. Cubeful 1-ply    8/4 6/4                      Eq.: -0.584 (-0.068)
       0.210 0.011 0.000 - 0.790 0.110 0.000
     5. Cubeful 1-ply    8/4 3/1                      Eq.: -0.613 (-0.097)
       0.200 0.011 0.000 - 0.800 0.114 0.000


Move number 28:  lasse to play 61

 GNU Backgammon  Position ID: t2cDAAyb7QwMAA
                 Match ID   : QQlnAAAAAAAE
 +13-14-15-16-17-18------19-20-21-22-23-24-+     O: jonnyb1169 (Cube: 2)
 |    X             |   | O  O     O  O  O |     0 points
 |    X             |   | O  O     O  O  O |     
 |                  |   |          O     O |     
 |                  |   |          O       |     
 |                  |   |                  |    
v|                  |BAR|                  |     3 points match
 |                  |   |                  |    
 |                  |   |                  |     
 |                  |   | X                |     
 |             X    |   | X  X  X  O  X  X |     Rolled 61
 |             X    |   | X  X  X  O  X  X |     0 points
 +12-11-10--9--8--7-------6--5--4--3--2--1-+     X: lasse
Pip counts: O 85, X 86

* lasse moves 14/13 14/8

Rolled 61:
*    1. Cubeful 1-ply    14/13 14/8                   Eq.: +0.494
       0.765 0.075 0.001 - 0.235 0.006 0.000
     2. Cubeful 1-ply    14/8 6/5                     Eq.: +0.493 (-0.000)
       0.762 0.085 0.001 - 0.238 0.007 0.000
     3. Cubeful 1-ply    14/8 2/1                     Eq.: +0.381 (-0.113)
       0.722 0.069 0.001 - 0.278 0.012 0.000
     4. Cubeful 1-ply    14/7                         Eq.: +0.153 (-0.341)
       0.631 0.086 0.001 - 0.369 0.060 0.001
     5. Cubeful 0-ply    8/7 8/2                      Eq.: +0.174 (-0.319)
       0.637 0.090 0.000 - 0.363 0.042 0.000


Move number 29:  jonnyb1169 to play 62

 GNU Backgammon  Position ID: m+0cBAC3ZwMADA
                 Match ID   : AQFrAAAAAAAE
 +12-11-10--9--8--7-------6--5--4--3--2--1-+     O: jonnyb1169 (Cube: 2)
 | X                |   | O  O     O  O  O |     0 points
 |                  |   | O  O     O  O  O |     Rolled 62
 |                  |   |          O     O |     
 |                  |   |          O       |     
 |                  |   |                  |    
^|                  |BAR|                  |     3 points match
 |                  |   |                  |    
 |                  |   |                  |     
 |             X    |   | X                |     
 |             X    |   | X  X  X  O  X  X |     
 |             X    |   | X  X  X  O  X  X |     0 points
 +13-14-15-16-17-18------19-20-21-22-23-24-+     X: lasse
Pip counts: O 85, X 79

* jonnyb1169 moves 22/14

Cube analysis
1-ply cubeless equity -0.599 (Money: -0.601)
  0.235 0.006 0.000 - 0.765 0.075 0.001
Cubeful equities:
1. No double           -0.494
2. Double, pass        +1.000  (+1.494)
3. Double, take        -1.059  (-0.565)
Proper cube action: No redouble, take (27.5%)

Rolled 62:
*    1. Cubeful 1-ply    22/14                        Eq.: -0.761
       0.166 0.020 0.000 - 0.834 0.182 0.005
     2. Cubeful 1-ply    22/16 3/1                    Eq.: -0.809 (-0.048)
       0.154 0.016 0.000 - 0.846 0.198 0.005
     3. Cubeful 1-ply    22/16 5/3                    Eq.: -0.987 (-0.227)
       0.117 0.009 0.000 - 0.883 0.286 0.008
     4. Cubeful 1-ply    22/16 6/4                    Eq.: -1.016 (-0.256)
       0.124 0.015 0.000 - 0.876 0.337 0.009


Move number 30:  lasse to play 65

 GNU Backgammon  Position ID: t2cDBAib7RwEAA
                 Match ID   : QQl3AAAAAAAE
 +13-14-15-16-17-18------19-20-21-22-23-24-+     O: jonnyb1169 (Cube: 2)
 | X                |   | O  O     O  O  O |     0 points
 |                  |   | O  O     O  O  O |     
 |                  |   |          O     O |     
 |                  |   |          O       |     
 |                  |   |                  |    
v|                  |BAR|                  |     3 points match
 |                  |   |                  |    
 |                  |   |                  |     
 |             X    |   | X                |     
 |             X    |   | X  X  X     X  X |     Rolled 65
 |    O        X    |   | X  X  X  O  X  X |     0 points
 +12-11-10--9--8--7-------6--5--4--3--2--1-+     X: lasse
Pip counts: O 77, X 79

* lasse moves 13/2
Alert: bad move ( -0.099)

Rolled 65:
     1. Cubeful 1-ply    13/7 8/3*                    Eq.: +0.446
       0.741 0.096 0.001 - 0.259 0.042 0.001
     2. Cubeful 1-ply    8/3* 8/2                     Eq.: +0.373 (-0.073)
       0.699 0.136 0.002 - 0.301 0.088 0.002
*    3. Cubeful 1-ply    13/2                         Eq.: +0.347 (-0.099)
       0.728 0.011 0.000 - 0.272 0.002 0.000
     4. Cubeful 0-ply    8/2 6/1                      Eq.: -0.099 (-0.545)
       0.546 0.023 0.000 - 0.454 0.018 0.000
     5. Cubeful 0-ply    13/7 6/1                     Eq.: -0.118 (-0.564)
       0.541 0.017 0.000 - 0.459 0.017 0.000


Move number 31:  jonnyb1169 to play 64

 GNU Backgammon  Position ID: O9s5AAC3ZwMECA
                 Match ID   : AQFzAAAAAAAE
 +12-11-10--9--8--7-------6--5--4--3--2--1-+     O: jonnyb1169 (Cube: 2)
 |                  |   | O  O     O  O  O |     0 points
 |                  |   | O  O     O  O  O |     Rolled 64
 |                  |   |          O     O |     
 |                  |   |          O       |     
 |                  |   |                  |    
^|                  |BAR|                  |     3 points match
 |                  |   |                  |    
 |                  |   |                  |     
 |             X    |   | X           X    |     
 |             X    |   | X  X  X     X  X |     
 |    O        X    |   | X  X  X  O  X  X |     0 points
 +13-14-15-16-17-18------19-20-21-22-23-24-+     X: lasse
Pip counts: O 77, X 68

* jonnyb1169 moves 22/12

Cube analysis
1-ply cubeless equity -0.464 (Money: -0.465)
  0.272 0.002 0.000 - 0.728 0.011 0.000
Cubeful equities:
1. No double           -0.347
2. Double, pass        +1.000  (+1.347)
3. Double, take        -0.909  (-0.561)
Proper cube action: No redouble, take (29.4%)

Rolled 64:
     1. Cubeful 1-ply    22/16 14/10                  Eq.: -0.189
       0.335 0.000 0.000 - 0.665 0.000 0.000
*    2. Cubeful 1-ply    22/12                        Eq.: -0.202 (-0.013)
       0.330 0.000 0.000 - 0.670 0.000 0.000
     3. Cubeful 1-ply    22/16 6/2                    Eq.: -0.298 (-0.109)
       0.290 0.000 0.000 - 0.710 0.000 0.000
     4. Cubeful 1-ply    22/16 5/1                    Eq.: -0.346 (-0.157)
       0.270 0.000 0.000 - 0.730 0.000 0.000
     5. Cubeful 1-ply    22/18 14/8                   Eq.: -0.381 (-0.192)
       0.256 0.001 0.000 - 0.744 0.009 0.000


Move number 32:  lasse to play 43

 GNU Backgammon  Position ID: t2cDCQA72zkAAA
                 Match ID   : QQluAAAAAAAE
 +13-14-15-16-17-18------19-20-21-22-23-24-+     O: jonnyb1169 (Cube: 2)
 | O                |   | O  O     O  O  O |     0 points
 |                  |   | O  O     O  O  O |     
 |                  |   |          O     O |     
 |                  |   |          O       |     
 |                  |   |                  |    
v|                  |BAR|                  |     3 points match
 |                  |   |                  |    
 |                  |   |                  |     
 |             X    |   | X           X    |     
 |             X    |   | X  X  X     X  X |     Rolled 43
 |    O        X    |   | X  X  X     X  X |     0 points
 +12-11-10--9--8--7-------6--5--4--3--2--1-+     X: lasse
Pip counts: O 67, X 68

* lasse moves 8/5 8/4

Rolled 43:
*    1. Cubeful 1-ply    8/5 8/4                      Eq.: +0.177
       0.659 0.000 0.000 - 0.341 0.000 0.000
     2. Cubeful 1-ply    8/4 6/3                      Eq.: +0.107 (-0.070)
       0.629 0.000 0.000 - 0.371 0.000 0.000
     3. Cubeful 1-ply    8/5 6/2                      Eq.: +0.035 (-0.141)
       0.599 0.000 0.000 - 0.401 0.000 0.000
     4. Cubeful 1-ply    8/1                          Eq.: +0.021 (-0.156)
       0.593 0.000 0.000 - 0.407 0.000 0.000
     5. Cubeful 1-ply    8/4 5/2                      Eq.: +0.014 (-0.163)
       0.590 0.000 0.000 - 0.410 0.000 0.000


Move number 33:  jonnyb1169 to play 52

 GNU Backgammon  Position ID: O3cnAAC3ZwMJAA
                 Match ID   : AYFqAAAAAAAE
 +12-11-10--9--8--7-------6--5--4--3--2--1-+     O: jonnyb1169 (Cube: 2)
 | O                |   | O  O     O  O  O |     0 points
 |                  |   | O  O     O  O  O |     Rolled 52
 |                  |   |          O     O |     
 |                  |   |          O       |     
 |                  |   |                  |    
^|                  |BAR|                  |     3 points match
 |                  |   |                  |    
 |                  |   |                  |     
 |                  |   | X  X  X     X    |     
 |                  |   | X  X  X     X  X |     
 |    O        X    |   | X  X  X     X  X |     0 points
 +13-14-15-16-17-18------19-20-21-22-23-24-+     X: lasse
Pip counts: O 67, X 61

* jonnyb1169 moves 14/9 12/10

Cube analysis
1-ply cubeless equity -0.318 (Money: -0.318)
  0.341 0.000 0.000 - 0.659 0.000 0.000
Cubeful equities:
1. No double           -0.177
2. Double, pass        +1.000  (+1.177)
3. Double, take        -0.634  (-0.457)
Proper cube action: No redouble, take (28.0%)

Rolled 52:
     1. Cubeful 1-ply    14/9 6/4                     Eq.: -0.267
       0.303 0.000 0.000 - 0.697 0.000 0.000
*    2. Cubeful 1-ply    14/9 12/10                   Eq.: -0.277 (-0.010)
       0.299 0.000 0.000 - 0.701 0.000 0.000
     3. Cubeful 1-ply    12/5                         Eq.: -0.301 (-0.034)
       0.289 0.000 0.000 - 0.711 0.000 0.000
     4. Cubeful 1-ply    12/7 6/4                     Eq.: -0.304 (-0.036)
       0.288 0.000 0.000 - 0.712 0.000 0.000
     5. Cubeful 1-ply    14/7                         Eq.: -0.308 (-0.041)
       0.286 0.000 0.000 - 0.714 0.000 0.000


Move number 34:  lasse to play 42

 GNU Backgammon  Position ID: t2ejAAA7dycAAA
                 Match ID   : QQlqAAAAAAAE
 +13-14-15-16-17-18------19-20-21-22-23-24-+     O: jonnyb1169 (Cube: 2)
 |       O  O       |   | O  O     O  O  O |     0 points
 |                  |   | O  O     O  O  O |     
 |                  |   |          O     O |     
 |                  |   |          O       |     
 |                  |   |                  |    
v|                  |BAR|                  |     3 points match
 |                  |   |                  |    
 |                  |   |                  |     
 |                  |   | X  X  X     X    |     
 |                  |   | X  X  X     X  X |     Rolled 42
 |             X    |   | X  X  X     X  X |     0 points
 +12-11-10--9--8--7-------6--5--4--3--2--1-+     X: lasse
Pip counts: O 60, X 61

* lasse moves 8/4 2/off

Rolled 42:
*    1. Cubeful 1-ply    8/4 2/off                    Eq.: +0.170
       0.654 0.000 0.000 - 0.346 0.000 0.000
     2. Cubeful 1-ply    8/6 4/off                    Eq.: +0.135 (-0.035)
       0.640 0.000 0.000 - 0.360 0.000 0.000
     3. Cubeful 1-ply    8/4 5/3                      Eq.: +0.100 (-0.070)
       0.625 0.000 0.000 - 0.375 0.000 0.000
     4. Cubeful 1-ply    8/2                          Eq.: +0.036 (-0.134)
       0.597 0.000 0.000 - 0.403 0.000 0.000
     5. Cubeful 1-ply    8/4 6/4                      Eq.: +0.027 (-0.143)
       0.594 0.000 0.000 - 0.406 0.000 0.000


Move number 35:  jonnyb1169 to play 51

 GNU Backgammon  Position ID: m3cHAIDbs1EAAA
                 Match ID   : AYFmAAAAAAAE
 +12-11-10--9--8--7-------6--5--4--3--2--1-+     O: jonnyb1169 (Cube: 2)
 |       O  O       |   | O  O     O  O  O |     0 points
 |                  |   | O  O     O  O  O |     Rolled 51
 |                  |   |          O     O |     
 |                  |   |          O       |     
 |                  |   |                  |    
^|                  |BAR|                  |     3 points match
 |                  |   |                  |    
 |                  |   |       X          |     
 |                  |   | X  X  X          |     
 |                  |   | X  X  X     X  X |     
 |                  |   | X  X  X     X  X | X   0 points
 +13-14-15-16-17-18------19-20-21-22-23-24-+     X: lasse
Pip counts: O 60, X 55

* jonnyb1169 moves 10/4

Cube analysis
1-ply cubeless equity -0.309 (Money: -0.309)
  0.346 0.000 0.000 - 0.654 0.000 0.000
Cubeful equities:
1. No double           -0.170
2. Double, pass        +1.000  (+1.170)
3. Double, take        -0.616  (-0.446)
Proper cube action: No redouble, take (27.6%)

Rolled 51:
*    1. Cubeful 1-ply    10/4                         Eq.: -0.305
       0.288 0.000 0.000 - 0.712 0.000 0.000
     2. Cubeful 1-ply    9/4 5/4                      Eq.: -0.310 (-0.005)
       0.287 0.000 0.000 - 0.713 0.000 0.000
     3. Cubeful 1-ply    9/4 6/5                      Eq.: -0.315 (-0.010)
       0.284 0.000 0.000 - 0.716 0.000 0.000
     4. Cubeful 1-ply    9/4 3/2                      Eq.: -0.318 (-0.013)
       0.283 0.000 0.000 - 0.717 0.000 0.000
     5. Cubeful 1-ply    10/5 9/8                     Eq.: -0.353 (-0.048)
       0.269 0.000 0.000 - 0.731 0.000 0.000


Move number 36:  lasse to play 43

 GNU Backgammon  Position ID: t9dGAACbdwcAAA
                 Match ID   : QQluAAAAAAAE
 +13-14-15-16-17-18------19-20-21-22-23-24-+     O: jonnyb1169 (Cube: 2)
 |          O       |   | O  O  O  O  O  O |     0 points
 |                  |   | O  O     O  O  O |     
 |                  |   |          O     O |     
 |                  |   |          O       |     
 |                  |   |                  |    
v|                  |BAR|                  |     3 points match
 |                  |   |                  |    
 |                  |   |       X          |     
 |                  |   | X  X  X          |     
 |                  |   | X  X  X     X  X |     Rolled 43
 |                  |   | X  X  X     X  X | X   0 points
 +12-11-10--9--8--7-------6--5--4--3--2--1-+     X: lasse
Pip counts: O 54, X 55

* lasse moves 6/3 4/off

Rolled 43:
*    1. Cubeful 1-ply    6/3 4/off                    Eq.: +0.245
       0.685 0.000 0.000 - 0.315 0.000 0.000
     2. Cubeful 1-ply    5/2 4/off                    Eq.: +0.179 (-0.066)
       0.657 0.000 0.000 - 0.343 0.000 0.000
     3. Cubeful 1-ply    4/1 4/off                    Eq.: +0.136 (-0.109)
       0.639 0.000 0.000 - 0.361 0.000 0.000
     4. Cubeful 1-ply    6/3 6/2                      Eq.: +0.084 (-0.161)
       0.617 0.000 0.000 - 0.383 0.000 0.000
     5. Cubeful 1-ply    6/3 5/1                      Eq.: +0.080 (-0.165)
       0.615 0.000 0.000 - 0.385 0.000 0.000


Move number 37:  jonnyb1169 to play 64

 GNU Backgammon  Position ID: W3cDAMDttREAAA
                 Match ID   : AQFzAAAAAAAE
 +12-11-10--9--8--7-------6--5--4--3--2--1-+     O: jonnyb1169 (Cube: 2)
 |          O       |   | O  O  O  O  O  O |     0 points
 |                  |   | O  O     O  O  O |     Rolled 64
 |                  |   |          O     O |     
 |                  |   |          O       |     
 |                  |   |                  |    
^|                  |BAR|                  |     3 points match
 |                  |   |                  |    
 |                  |   |                  |     
 |                  |   |    X  X          |     
 |                  |   | X  X  X     X  X | X   
 |                  |   | X  X  X  X  X  X | X   0 points
 +13-14-15-16-17-18------19-20-21-22-23-24-+     X: lasse
Pip counts: O 54, X 48

* jonnyb1169 moves 9/5 6/off

Cube analysis
1-ply cubeless equity -0.370 (Money: -0.370)
  0.315 0.000 0.000 - 0.685 0.000 0.000
Cubeful equities:
1. No double           -0.245
2. Double, pass        +1.000  (+1.245)
3. Double, take        -0.739  (-0.494)
Proper cube action: No redouble, take (28.4%)

Rolled 64:
*    1. Cubeful 1-ply    9/5 6/off                    Eq.: -0.196
       0.335 0.000 0.000 - 0.665 0.000 0.000
     2. Cubeful 1-ply    9/3 4/off                    Eq.: -0.308 (-0.112)
       0.289 0.000 0.000 - 0.711 0.000 0.000
     3. Cubeful 1-ply    9/3 6/2                      Eq.: -0.375 (-0.179)
       0.261 0.000 0.000 - 0.739 0.000 0.000
     4. Cubeful 1-ply    9/3 5/1                      Eq.: -0.443 (-0.247)
       0.232 0.000 0.000 - 0.768 0.000 0.000


Move number 38:  lasse to play 66

 GNU Backgammon  Position ID: t9cFAICtuwEAAA
                 Match ID   : QQl7AAAAAAAE
 +13-14-15-16-17-18------19-20-21-22-23-24-+     O: jonnyb1169 (Cube: 2)
 |                  |   | O  O  O  O  O  O | O   0 points
 |                  |   |    O     O  O  O |     
 |                  |   |    O     O     O |     
 |                  |   |          O       |     
 |                  |   |                  |    
v|                  |BAR|                  |     3 points match
 |                  |   |                  |    
 |                  |   |                  |     
 |                  |   |    X  X          |     
 |                  |   | X  X  X     X  X | X   Rolled 66
 |                  |   | X  X  X  X  X  X | X   0 points
 +12-11-10--9--8--7-------6--5--4--3--2--1-+     X: lasse
Pip counts: O 44, X 48

* lasse moves 6/off(2) 5/off(2)

Rolled 66:
*    1. Cubeful 0-ply    6/off(2) 5/off(2)            Eq.: +0.902
       0.959 0.000 0.000 - 0.041 0.000 0.000


Move number 39:  jonnyb1169 to play 64

 GNU Backgammon  Position ID: WxcAANxeFwAAAA
                 Match ID   : AQFzAAAAAAAE
 +12-11-10--9--8--7-------6--5--4--3--2--1-+     O: jonnyb1169 (Cube: 2)
 |                  |   | O  O  O  O  O  O | O   0 points
 |                  |   |    O     O  O  O |     Rolled 64
 |                  |   |    O     O     O |     
 |                  |   |          O       |     
 |                  |   |                  |    
^|                  |BAR|                  |     3 points match
 |                  |   |                  | X  
 |                  |   |                  | X   
 |                  |   |       X          | X   
 |                  |   |       X     X  X | X   
 |                  |   |    X  X  X  X  X | XX  0 points
 +13-14-15-16-17-18------19-20-21-22-23-24-+     X: lasse
Pip counts: O 44, X 26

* jonnyb1169 moves 6/off 4/off

Cube analysis
1-ply cubeless equity -0.918 (Money: -0.918)
  0.041 0.000 0.000 - 0.959 0.000 0.000
Cubeful equities:
1. No double           -0.902
2. Double, pass        +1.000  (+1.902)
3. Double, take        -1.830  (-0.929)
Proper cube action: No redouble, take (32.8%)

Rolled 64:
*    1. Cubeful 1-ply    6/off 4/off                  Eq.: -0.918
       0.034 0.000 0.000 - 0.966 0.000 0.000
     2. Cubeful 1-ply    6/2 5/off                    Eq.: -0.968 (-0.051)
       0.013 0.000 0.000 - 0.987 0.000 0.000
     3. Cubeful 1-ply    6/off 5/1                    Eq.: -0.969 (-0.051)
       0.013 0.000 0.000 - 0.987 0.000 0.000


Move number 40:  lasse to play 61

 GNU Backgammon  Position ID: t+cAAGDrAgAAAA
                 Match ID   : QQlnAAAAAAAE
 +13-14-15-16-17-18------19-20-21-22-23-24-+     O: jonnyb1169 (Cube: 2)
 |                  |   |    O     O  O  O | O   0 points
 |                  |   |    O     O  O  O | O   
 |                  |   |    O     O     O | O   
 |                  |   |          O       |     
 |                  |   |                  |    
v|                  |BAR|                  |     3 points match
 |                  |   |                  | X  
 |                  |   |                  | X   
 |                  |   |       X          | X   
 |                  |   |       X     X  X | X   Rolled 61
 |                  |   |    X  X  X  X  X | XX  0 points
 +12-11-10--9--8--7-------6--5--4--3--2--1-+     X: lasse
Pip counts: O 34, X 26

* lasse moves 5/off 1/off

Rolled 61:
*    1. Cubeful 1-ply    5/off 1/off                  Eq.: +0.913
       0.964 0.000 0.000 - 0.036 0.000 0.000
     2. Cubeful 1-ply    5/off 4/3                    Eq.: +0.893 (-0.020)
       0.955 0.000 0.000 - 0.045 0.000 0.000
     3. Cubeful 1-ply    5/off                        Eq.: +0.842 (-0.072)
       0.934 0.000 0.000 - 0.066 0.000 0.000
     4. Cubeful 1-ply    5/off 2/1                    Eq.: +0.834 (-0.079)
       0.931 0.000 0.000 - 0.069 0.000 0.000
     5. Cubeful 1-ply    5/off 3/2                    Eq.: +0.780 (-0.133)
       0.908 0.000 0.000 - 0.092 0.000 0.000


Move number 41:  jonnyb1169 to play 54

 GNU Backgammon  Position ID: rQMAALfnAAAAAA
                 Match ID   : AYFyAAAAAAAE
 +12-11-10--9--8--7-------6--5--4--3--2--1-+     O: jonnyb1169 (Cube: 2)
 |                  |   |    O     O  O  O | O   0 points
 |                  |   |    O     O  O  O | O   Rolled 54
 |                  |   |    O     O     O | O   
 |                  |   |          O       |     
 |                  |   |                  |    
^|                  |BAR|                  |     3 points match
 |                  |   |                  | X  
 |                  |   |                  | X   
 |                  |   |       X          | XX  
 |                  |   |       X     X    | XX  
 |                  |   |       X  X  X  X | XX  0 points
 +13-14-15-16-17-18------19-20-21-22-23-24-+     X: lasse
Pip counts: O 34, X 20

* jonnyb1169 moves 5/1 5/off

Cube analysis
1-ply cubeless equity -0.928 (Money: -0.928)
  0.036 0.000 0.000 - 0.964 0.000 0.000
Cubeful equities:
1. No double           -0.913
2. Double, pass        +1.000  (+1.913)
3. Double, take        -1.850  (-0.936)
Proper cube action: No redouble, take (32.9%)

Rolled 54:
*    1. Cubeful 0-ply    5/1 5/off                    Eq.: -0.979
       0.009 0.000 0.000 - 0.991 0.000 0.000


Move number 42:  lasse to play 52

 GNU Backgammon  Position ID: b08AANA6AAAAAA
                 Match ID   : QYlqAAAAAAAE
 +13-14-15-16-17-18------19-20-21-22-23-24-+     O: jonnyb1169 (Cube: 2)
 |                  |   |    O     O  O  O | O   0 points
 |                  |   |          O  O  O | O   
 |                  |   |          O     O | O   
 |                  |   |          O     O | O   
 |                  |   |                  |    
v|                  |BAR|                  |     3 points match
 |                  |   |                  | X  
 |                  |   |                  | X   
 |                  |   |       X          | XX  
 |                  |   |       X     X    | XX  Rolled 52
 |                  |   |       X  X  X  X | XX  0 points
 +12-11-10--9--8--7-------6--5--4--3--2--1-+     X: lasse
Pip counts: O 25, X 20

* lasse moves 4/off 2/off

Rolled 52:
*    1. Cubeful 1-ply    4/off 2/off                  Eq.: +0.985
       0.994 0.000 0.000 - 0.006 0.000 0.000
     2. Cubeful 1-ply    4/2 4/off                    Eq.: +0.954 (-0.031)
       0.981 0.000 0.000 - 0.019 0.000 0.000
     3. Cubeful 1-ply    4/off 3/1                    Eq.: +0.930 (-0.054)
       0.971 0.000 0.000 - 0.029 0.000 0.000


Move number 43:  jonnyb1169 to play 61

 GNU Backgammon  Position ID: 1QAAwNsTAAAAAA
                 Match ID   : AQFnAAAAAAAE
 +12-11-10--9--8--7-------6--5--4--3--2--1-+     O: jonnyb1169 (Cube: 2)
 |                  |   |    O     O  O  O | O   0 points
 |                  |   |          O  O  O | O   Rolled 61
 |                  |   |          O     O | O   
 |                  |   |          O     O | O   
 |                  |   |                  |    
^|                  |BAR|                  |     3 points match
 |                  |   |                  | XX 
 |                  |   |                  | XX  
 |                  |   |                  | XX  
 |                  |   |       X          | XX  
 |                  |   |       X  X  X  X | XX  0 points
 +13-14-15-16-17-18------19-20-21-22-23-24-+     X: lasse
Pip counts: O 25, X 14

* jonnyb1169 moves 5/off 1/off

Cube analysis
1-ply cubeless equity -0.987 (Money: -0.987)
  0.006 0.000 0.000 - 0.994 0.000 0.000
Cubeful equities:
1. No double           -0.985
2. Double, pass        +1.000  (+1.985)
3. Double, take        -1.969  (-0.984)
Proper cube action: No redouble, take (33.1%)

Rolled 61:
*    1. Cubeful 1-ply    5/off 1/off                  Eq.: -0.995
       0.002 0.000 0.000 - 0.998 0.000 0.000
     2. Cubeful 1-ply    5/off 2/1                    Eq.: -0.995 (-0.000)
       0.002 0.000 0.000 - 0.998 0.000 0.000
     3. Cubeful 1-ply    5/off 3/2                    Eq.: -0.995 (-0.000)
       0.002 0.000 0.000 - 0.998 0.000 0.000
     4. Cubeful 1-ply    5/off                        Eq.: -0.995 (-0.000)
       0.002 0.000 0.000 - 0.998 0.000 0.000


Move number 44:  lasse to play 31

 GNU Backgammon  Position ID: twcAAFQDAAAAAA
                 Match ID   : QYllAAAAAAAE
 +13-14-15-16-17-18------19-20-21-22-23-24-+     O: jonnyb1169 (Cube: 2)
 |                  |   |          O  O  O | OO  0 points
 |                  |   |          O  O  O | O   
 |                  |   |          O     O | O   
 |                  |   |          O       | O   
 |                  |   |                  | O  
v|                  |BAR|                  |     3 points match
 |                  |   |                  | XX 
 |                  |   |                  | XX  
 |                  |   |                  | XX  
 |                  |   |       X          | XX  Rolled 31
 |                  |   |       X  X  X  X | XX  0 points
 +12-11-10--9--8--7-------6--5--4--3--2--1-+     X: lasse
Pip counts: O 19, X 14

* lasse moves 3/off 1/off

Rolled 31:
*    1. Cubeful 1-ply    3/off 1/off                  Eq.: +0.986
       0.993 0.000 0.000 - 0.007 0.000 0.000
     2. Cubeful 1-ply    4/off                        Eq.: +0.984 (-0.002)
       0.992 0.000 0.000 - 0.008 0.000 0.000
     3. Cubeful 1-ply    3/off 2/1                    Eq.: +0.942 (-0.044)
       0.973 0.000 0.000 - 0.027 0.000 0.000
     4. Cubeful 1-ply    4/1 3/2                      Eq.: +0.911 (-0.075)
       0.958 0.000 0.000 - 0.042 0.000 0.000
     5. Cubeful 1-ply    4/1 2/1                      Eq.: +0.908 (-0.078)
       0.957 0.000 0.000 - 0.043 0.000 0.000


Move number 45:  jonnyb1169 to play 55

 GNU Backgammon  Position ID: MgAAcHsAAAAAAA
                 Match ID   : AYF2AAAAAAAE
 +12-11-10--9--8--7-------6--5--4--3--2--1-+     O: jonnyb1169 (Cube: 2)
 |                  |   |          O  O  O | OO  0 points
 |                  |   |          O  O  O | O   Rolled 55
 |                  |   |          O     O | O   
 |                  |   |          O       | O   
 |                  |   |                  | O  
^|                  |BAR|                  |     3 points match
 |                  |   |                  | XX 
 |                  |   |                  | XX  
 |                  |   |                  | XX  
 |                  |   |       X          | XXX 
 |                  |   |       X     X    | XXX 0 points
 +13-14-15-16-17-18------19-20-21-22-23-24-+     X: lasse
Pip counts: O 19, X 10

* jonnyb1169 moves 3/off(4)

Cube analysis
1-ply cubeless equity -0.987 (Money: -0.987)
  0.007 0.000 0.000 - 0.993 0.000 0.000
Cubeful equities:
1. No double           -0.986
2. Double, pass        +1.000  (+1.986)
3. Double, take        -1.968  (-0.982)
Proper cube action: No redouble, take (33.1%)

Rolled 55:
*    1. Cubeful 0-ply    3/off(4)                     Eq.: -0.931
       0.034 0.000 0.000 - 0.966 0.000 0.000


Move number 46:  lasse to play 61

 GNU Backgammon  Position ID: NwAAgAwAAAAAAA
                 Match ID   : QQlnAAAAAAAE
 +13-14-15-16-17-18------19-20-21-22-23-24-+     O: jonnyb1169 (Cube: 2)
 |                  |   |             O  O | OO  0 points
 |                  |   |             O  O | OO  
 |                  |   |                O | OO  
 |                  |   |                  | OO  
 |                  |   |                  | OO 
v|                  |BAR|                  |     3 points match
 |                  |   |                  | XX 
 |                  |   |                  | XX  
 |                  |   |                  | XX  
 |                  |   |       X          | XXX Rolled 61
 |                  |   |       X     X    | XXX 0 points
 +12-11-10--9--8--7-------6--5--4--3--2--1-+     X: lasse
Pip counts: O 7, X 10

* lasse moves 4/off 2/1

Rolled 61:
*    1. Cubeful 1-ply    4/off 2/1                    Eq.: +0.881
       0.941 0.000 0.000 - 0.059 0.000 0.000
     2. Cubeful 1-ply    4/3 4/off                    Eq.: +0.813 (-0.068)
       0.907 0.000 0.000 - 0.093 0.000 0.000


Move number 47:  jonnyb1169 to play 51

 GNU Backgammon  Position ID: EQAAuAEAAAAAAA
                 Match ID   : AYFmAAAAAAAE
 +12-11-10--9--8--7-------6--5--4--3--2--1-+     O: jonnyb1169 (Cube: 2)
 |                  |   |             O  O | OO  0 points
 |                  |   |             O  O | OO  Rolled 51
 |                  |   |                O | OO  
 |                  |   |                  | OO  
 |                  |   |                  | OO 
^|                  |BAR|                  |     3 points match
 |                  |   |                  | XX 
 |                  |   |                  | XX  
 |                  |   |                  | XXX 
 |                  |   |                  | XXX 
 |                  |   |       X        X | XXX 0 points
 +13-14-15-16-17-18------19-20-21-22-23-24-+     X: lasse
Pip counts: O 7, X 5

* jonnyb1169 moves 2/off 1/off

Cube analysis
1-ply cubeless equity -0.881 (Money: -0.881)
  0.059 0.000 0.000 - 0.941 0.000 0.000
Cubeful equities:
1. No double           -0.881
2. Double, pass        +1.000  (+1.881)
3. Double, take        -1.757  (-0.876)
Proper cube action: No redouble, take (31.8%)

Rolled 51:
     1. Cubeful 1-ply    2/1 2/off                    Eq.: -0.935
       0.032 0.000 0.000 - 0.968 0.000 0.000
*    2. Cubeful 1-ply    2/off 1/off                  Eq.: -0.935 (-0.000)
       0.032 0.000 0.000 - 0.968 0.000 0.000


Move number 48:  lasse to play 21

 GNU Backgammon  Position ID: CwAAEAEAAAAAAA
                 Match ID   : QQllAAAAAAAE
 +13-14-15-16-17-18------19-20-21-22-23-24-+     O: jonnyb1169 (Cube: 2)
 |                  |   |             O  O | OOO 0 points
 |                  |   |                O | OOO 
 |                  |   |                  | OO  
 |                  |   |                  | OO  
 |                  |   |                  | OO 
v|                  |BAR|                  |     3 points match
 |                  |   |                  | XX 
 |                  |   |                  | XX  
 |                  |   |                  | XXX 
 |                  |   |                  | XXX Rolled 21
 |                  |   |       X        X | XXX 0 points
 +12-11-10--9--8--7-------6--5--4--3--2--1-+     X: lasse
Pip counts: O 4, X 5

* lasse moves 4/2 1/off

Rolled 21:
     1. Cubeful 1-ply    4/1                          Eq.: +0.667
       0.833 0.000 0.000 - 0.167 0.000 0.000
*    2. Cubeful 1-ply    4/2 1/off                    Eq.: +0.667 (-0.000)
       0.833 0.000 0.000 - 0.167 0.000 0.000


Move number 49:  jonnyb1169 to play 51

 GNU Backgammon  Position ID: AgAALAAAAAAAAA
                 Match ID   : AYFmAAAAAAAE
 +12-11-10--9--8--7-------6--5--4--3--2--1-+     O: jonnyb1169 (Cube: 2)
 |                  |   |             O  O | OOO 0 points
 |                  |   |                O | OOO Rolled 51
 |                  |   |                  | OO  
 |                  |   |                  | OO  
 |                  |   |                  | OO 
^|                  |BAR|                  |     3 points match
 |                  |   |                  | XX 
 |                  |   |                  | XXX 
 |                  |   |                  | XXX 
 |                  |   |                  | XXX 
 |                  |   |             X    | XXX 0 points
 +13-14-15-16-17-18------19-20-21-22-23-24-+     X: lasse
Pip counts: O 4, X 2

* jonnyb1169 moves 2/off 1/off

Cube analysis
1-ply cubeless equity -0.667 (Money: -0.667)
  0.167 0.000 0.000 - 0.833 0.000 0.000
Cubeful equities:
1. No double           -0.667
2. Double, pass        +1.000  (+1.667)
3. Double, take        -1.329  (-0.663)
Proper cube action: No redouble, take (28.4%)

Rolled 51:
*    1. Cubeful 1-ply    2/off 1/off                  Eq.: -1.000
       0.000 0.000 0.000 - 1.000 0.000 0.000
     2. Cubeful 1-ply    2/off                        Eq.: -1.000 (-0.000)
       0.000 0.000 0.000 - 1.000 0.000 0.000


Move number 50:  lasse to play 64

 GNU Backgammon  Position ID: AQAACAAAAAAAAA
                 Match ID   : QQlzAAAAAAAE
 +13-14-15-16-17-18------19-20-21-22-23-24-+     O: jonnyb1169 (Cube: 2)
 |                  |   |                O | OOO 0 points
 |                  |   |                  | OOO 
 |                  |   |                  | OOO 
 |                  |   |                  | OOO 
 |                  |   |                  | OO 
v|                  |BAR|                  |     3 points match
 |                  |   |                  | XX 
 |                  |   |                  | XXX 
 |                  |   |                  | XXX 
 |                  |   |                  | XXX Rolled 64
 |                  |   |             X    | XXX 0 points
 +12-11-10--9--8--7-------6--5--4--3--2--1-+     X: lasse
Pip counts: O 1, X 2

* lasse moves 2/off

Rolled 64:
*    1. Cubeful 0-ply    2/off                        Eq.: +1.000
       1.000 0.000 0.000 - 0.000 0.000 0.000


lasse wins 2 points

Game statistics for game 1

Player                                   jonnyb1169              lasse                  

Chequerplay statistics

Total moves                               24                      24                    
Unforced moves                            21                      22                    
Unmarked moves                            23                      23                    
Moves marked doubtful                      1                       0                    
Moves marked bad                           0                       1                    
Moves marked very bad                      0                       0                    
Error total EMG (MWC)                         -0.055 ( -1.379%)       -0.166 ( -4.166%) 
Error rate mEMG (MWC)                         -2.6   ( -0.066%)       -7.6   ( -0.189%) 
Chequerplay rating                       World class             Expert                 


Cube statistics

Total cube decisions                      24                       3                    
Close or actual cube decisions             1                       2                    
Doubles                                    0                       1                    
Takes                                      1                       0                    
Passes                                     0                       0                    
Missed doubles below CP (EMG (MWC))        0                       0                    
Missed doubles above CP (EMG (MWC))        0                       0                    
Wrong doubles below DP (EMG (MWC))         0                       0                    
Wrong doubles above TG (EMG (MWC))         0                       0                    
Wrong takes (EMG (MWC))                    0                       0                    
Wrong passes (EMG (MWC))                   0                       0                    
Error total EMG (MWC)                         -0.000 ( -0.000%)       -0.000 ( -0.000%) 
Error rate mEMG (MWC)                         -0.0   ( -0.000%)       -0.0   ( -0.000%) 
Cube decision rating                     Supernatural            Supernatural           


Overall statistics

Error total EMG (MWC)                         -0.055 ( -1.379%)       -0.166 ( -4.166%) 
Error rate mEMG (MWC)                         -2.5   ( -0.063%)       -6.9   ( -0.174%) 
Snowie error rate                             -1.1   ( +0.000%)       -3.5   ( +0.000%) 
Overall rating                           World class             Expert                 
Error based abs. FIBS rating             2004.7                  1919.3                 
Chequerplay errors rating loss             45.3                   130.7                 
Cube errors rating loss                     0.0                     0.0                 




Output generated Mon Oct 09 16:12:11 2023
 by GNU Backgammon 1.07.001-mingw 32-Bit 20221114 (Text Export version 1.128)

