The score (after 1 game) is: klara 0, lasse 2 (match to 5 points)

Match Information:
Date: 16/09/2023
Place: BackgammonGalaxy

Move number 1:  lasse to play 53

 GNU Backgammon  Position ID: 4HPwATDgc/ABMA
                 Match ID   : cIiuAAAAEAAE
 +13-14-15-16-17-18------19-20-21-22-23-24-+     O: klara
 | X           O    |   | O              X |     0 points
 | X           O    |   | O              X |     
 | X           O    |   | O                |     
 | X                |   | O                |     
 | X                |   | O                |    
v|                  |BAR|                  |     5 points match (Cube: 1)
 | O                |   | X                |    
 | O                |   | X                |     
 | O           X    |   | X                |     
 | O           X    |   | X              O |     Rolled 53
 | O           X    |   | X              O |     2 points
 +12-11-10--9--8--7-------6--5--4--3--2--1-+     X: lasse
Pip counts: O 167, X 167

* lasse moves 8/3 6/3

Rolled 53:
*    1. Cubeful 2-ply    8/3 6/3                      Eq.: -0.008
       0.515 0.158 0.008 - 0.485 0.132 0.005
     2. Cubeful 2-ply    24/21 13/8                   Eq.: -0.043 (-0.035)
       0.509 0.138 0.006 - 0.491 0.131 0.004
     3. Cubeful 2-ply    24/16                        Eq.: -0.090 (-0.082)
       0.502 0.122 0.004 - 0.498 0.138 0.005
     4. Cubeful 2-ply    13/10 13/8                   Eq.: -0.092 (-0.084)
       0.495 0.150 0.009 - 0.505 0.141 0.007
     5. Cubeful 2-ply    13/5                         Eq.: -0.121 (-0.113)
       0.490 0.141 0.007 - 0.510 0.140 0.008


Move number 2:  klara to play 51

 GNU Backgammon  Position ID: jGfwATDgc/ABMA
                 Match ID   : MIGmAAAAEAAE
 +12-11-10--9--8--7-------6--5--4--3--2--1-+     O: klara
 | X           O    |   | O              X |     0 points
 | X           O    |   | O              X |     Rolled 51
 | X           O    |   | O                |     
 | X                |   | O                |     
 | X                |   | O                |    
^|                  |BAR|                  |     5 points match (Cube: 1)
 | O                |   |                  |    
 | O                |   | X                |     
 | O                |   | X                |     
 | O           X    |   | X        X     O |     
 | O           X    |   | X        X     O |     2 points
 +13-14-15-16-17-18------19-20-21-22-23-24-+     X: lasse
Pip counts: O 167, X 159

* klara moves 24/23 13/8

Cube analysis
2-ply cubeless equity -0.111 (Money: -0.060)
  0.485 0.132 0.005 - 0.515 0.158 0.008
Cubeful equities:
1. No double           +0.008
2. Double, pass        +1.000  (+0.992)
3. Double, take        -0.226  (-0.234)
Proper cube action: No double, take (19.1%)

Rolled 51:
*    1. Cubeful 2-ply    24/23 13/8                   Eq.: -0.089
       0.461 0.120 0.005 - 0.539 0.166 0.006
     2. Cubeful 2-ply    13/8 6/5                     Eq.: -0.135 (-0.046)
       0.449 0.118 0.006 - 0.551 0.175 0.012
     3. Cubeful 2-ply    24/18                        Eq.: -0.159 (-0.070)
       0.451 0.106 0.005 - 0.549 0.187 0.007
     4. Cubeful 2-ply    13/7                         Eq.: -0.194 (-0.105)
       0.434 0.114 0.005 - 0.566 0.179 0.013
     5. Cubeful 2-ply    24/23 8/3                    Eq.: -0.289 (-0.200)
       0.416 0.105 0.005 - 0.584 0.213 0.013


Move number 3:  lasse to play 65

 GNU Backgammon  Position ID: 4PPgASiMZ/ABMA
                 Match ID   : cAm3AAAAEAAE
 +13-14-15-16-17-18------19-20-21-22-23-24-+     O: klara
 | X           O    |   | O              X |     0 points
 | X           O    |   | O              X |     
 | X           O    |   | O                |     
 | X           O    |   | O                |     
 | X                |   | O                |    
v|                  |BAR|                  |     5 points match (Cube: 1)
 |                  |   |                  |    
 | O                |   | X                |     
 | O                |   | X                |     
 | O           X    |   | X        X       |     Rolled 65
 | O           X    |   | X        X  O  O |     2 points
 +12-11-10--9--8--7-------6--5--4--3--2--1-+     X: lasse
Pip counts: O 161, X 159

* lasse moves 13/2*

Cube analysis
2-ply cubeless equity +0.175 (Money: +0.126)
  0.539 0.166 0.006 - 0.461 0.120 0.005
Cubeful equities:
1. No double           +0.089
2. Double, pass        +1.000  (+0.911)
3. Double, take        -0.423  (-0.512)
Proper cube action: No double, take (36.0%)
Alert: bad move ( -0.098)

Rolled 65:
     1. Cubeful 2-ply    24/13                        Eq.: +0.084
       0.545 0.137 0.004 - 0.455 0.119 0.003
     2. Cubeful 2-ply    24/18 13/8                   Eq.: +0.057 (-0.028)
       0.536 0.147 0.007 - 0.464 0.121 0.003
*    3. Cubeful 2-ply    13/2*                        Eq.: -0.014 (-0.098)
       0.512 0.166 0.008 - 0.488 0.131 0.006
     4. Cubeful 2-ply    24/18 6/1*                   Eq.: -0.066 (-0.150)
       0.504 0.139 0.004 - 0.496 0.134 0.005
     5. Cubeful 2-ply    13/8 13/7                    Eq.: -0.078 (-0.162)
       0.495 0.152 0.007 - 0.505 0.131 0.006


Move number 4:  klara to play 42

 GNU Backgammon  Position ID: Gs/gATDg8+ABUA
                 Match ID   : MAGqAAAAEAAE
 +12-11-10--9--8--7-------6--5--4--3--2--1-+     O: klara
 | X           O    | O | O              X |     0 points
 | X           O    |   | O              X |     Rolled 42
 | X           O    |   | O                |     
 | X           O    |   | O                |     
 |                  |   | O                |    
^|                  |BAR|                  |     5 points match (Cube: 1)
 |                  |   |                  |    
 | O                |   | X                |     
 | O                |   | X                |     
 | O           X    |   | X        X       |     
 | O           X    |   | X        X  X  O |     2 points
 +13-14-15-16-17-18------19-20-21-22-23-24-+     X: lasse
Pip counts: O 163, X 148

* klara moves bar/23* 24/20

Cube analysis
2-ply cubeless equity -0.112 (Money: -0.061)
  0.488 0.131 0.006 - 0.512 0.166 0.008
Cubeful equities:
1. No double           +0.014
2. Double, pass        +1.000  (+0.986)
3. Double, take        -0.214  (-0.228)
Proper cube action: No double, take (18.8%)

Rolled 42:
     1. Cubeful 2-ply    bar/23* 13/9                 Eq.: +0.165
       0.519 0.155 0.010 - 0.481 0.141 0.007
*    2. Cubeful 2-ply    bar/23* 24/20                Eq.: +0.140 (-0.025)
       0.518 0.139 0.007 - 0.482 0.134 0.005
     3. Cubeful 2-ply    bar/23* 8/4                  Eq.: -0.005 (-0.171)
       0.481 0.132 0.008 - 0.519 0.164 0.010
     4. Cubeful 2-ply    bar/23* 6/2                  Eq.: -0.051 (-0.216)
       0.473 0.121 0.007 - 0.527 0.168 0.009
     5. Cubeful 2-ply    bar/21 13/11                 Eq.: -0.141 (-0.306)
       0.454 0.122 0.006 - 0.546 0.208 0.009


Move number 5:  lasse to play 63

 GNU Backgammon  Position ID: 4PPgARGMZ/AAWA
                 Match ID   : cAmvAAAAEAAE
 +13-14-15-16-17-18------19-20-21-22-23-24-+     O: klara
 | X           O    |   | O              X |     0 points
 | X           O    |   | O              X |     
 | X           O    |   | O                |     
 | X           O    |   | O                |     
 |                  |   | O                |    
v|                  |BAR|                  |     5 points match (Cube: 1)
 |                  |   |                  |    
 | O                |   | X                |     
 | O                |   | X                |     
 | O           X    |   | X        X       |     Rolled 63
 | O           X    | X | X  O     X  O    |     2 points
 +12-11-10--9--8--7-------6--5--4--3--2--1-+     X: lasse
Pip counts: O 157, X 171

* lasse moves bar/22 24/18

Cube analysis
2-ply cubeless equity +0.003 (Money: -0.043)
  0.482 0.134 0.005 - 0.518 0.139 0.007
Cubeful equities:
1. No double           -0.140
2. Double, pass        +1.000  (+1.140)
3. Double, take        -0.950  (-0.810)
Proper cube action: No double, take (41.5%)

Rolled 63:
*    1. Cubeful 2-ply    bar/22 24/18                 Eq.: -0.247
       0.462 0.118 0.005 - 0.538 0.157 0.007
     2. Cubeful 2-ply    bar/16                       Eq.: -0.271 (-0.024)
       0.455 0.118 0.004 - 0.545 0.153 0.009
     3. Cubeful 2-ply    bar/22 13/7                  Eq.: -0.281 (-0.034)
       0.453 0.133 0.006 - 0.547 0.161 0.011
     4. Cubeful 2-ply    bar/22 8/2*                  Eq.: -0.383 (-0.136)
       0.437 0.122 0.005 - 0.563 0.178 0.015


Move number 6:  klara to play 66

 GNU Backgammon  Position ID: jGfwICTg8+ABEQ
                 Match ID   : MAG7AAAAEAAE
 +12-11-10--9--8--7-------6--5--4--3--2--1-+     O: klara
 | X           O  X |   | O        X     X |     0 points
 | X           O    |   | O                |     Rolled 66
 | X           O    |   | O                |     
 | X           O    |   | O                |     
 |                  |   | O                |    
^|                  |BAR|                  |     5 points match (Cube: 1)
 |                  |   |                  |    
 | O                |   | X                |     
 | O                |   | X                |     
 | O           X    |   | X        X       |     
 | O           X    |   | X  O     X  O    |     2 points
 +13-14-15-16-17-18------19-20-21-22-23-24-+     X: lasse
Pip counts: O 157, X 162

* klara moves 13/7*/1*(2)

Cube analysis
2-ply cubeless equity +0.071 (Money: +0.117)
  0.538 0.157 0.007 - 0.462 0.118 0.005
Cubeful equities:
1. No double           +0.247
2. Double, pass        +1.000  (+0.753)
3. Double, take        +0.120  (-0.127)
Proper cube action: No double, take (14.4%)

Rolled 66:
*    1. Cubeful 2-ply    13/7*/1*(2)                  Eq.: +0.604
       0.586 0.245 0.010 - 0.414 0.106 0.004
     2. Cubeful 2-ply    20/8 13/7*(2)                Eq.: +0.515 (-0.090)
       0.610 0.170 0.006 - 0.390 0.098 0.002
     3. Cubeful 2-ply    13/7*(2) 8/2(2)              Eq.: +0.464 (-0.141)
       0.578 0.203 0.009 - 0.422 0.108 0.004
     4. Cubeful 2-ply    13/7*/1* 8/2(2)              Eq.: +0.381 (-0.223)
       0.545 0.213 0.009 - 0.455 0.123 0.005
     5. Cubeful 2-ply    13/7*(4)                     Eq.: +0.354 (-0.251)
       0.559 0.176 0.007 - 0.441 0.105 0.004


Move number 7:  lasse to play 53

 GNU Backgammon  Position ID: g8+DARGMZ/AAYg
                 Match ID   : cImuAAAAEAAE
 +13-14-15-16-17-18------19-20-21-22-23-24-+     O: klara
 | X           O    |   | O        X     O |     0 points
 | X           O    |   | O              O |     
 | X           O    |   | O                |     
 | X           O    |   | O                |     
 |                  |   | O                |    
v|                  |BAR|                  |     5 points match (Cube: 1)
 |                  |   |                  |    
 |                  |   | X                |     
 |                  |   | X                |     
 | O           X    | X | X        X       |     Rolled 53
 | O           X    | X | X  O     X  O    |     2 points
 +12-11-10--9--8--7-------6--5--4--3--2--1-+     X: lasse
Pip counts: O 133, X 170

* lasse moves bar/22 bar/20

Cube analysis
2-ply cubeless equity -0.259 (Money: -0.317)
  0.414 0.106 0.004 - 0.586 0.245 0.010
Cubeful equities:
1. No double           -0.604
2. Double, pass        +1.000  (+1.604)
3. Double, take        -1.574  (-0.969)
Proper cube action: No double, take (37.7%)

Rolled 53:
*    1. Cubeful 0-ply    bar/22 bar/20                Eq.: -0.199
       0.469 0.115 0.005 - 0.531 0.147 0.003


Move number 8:  klara to play 64

 GNU Backgammon  Position ID: jGfwgAyDz4MBEQ
                 Match ID   : MAGzAAAAEAAE
 +12-11-10--9--8--7-------6--5--4--3--2--1-+     O: klara
 | X           O    |   | O  X     X     O |     0 points
 | X           O    |   | O        X     O |     Rolled 64
 | X           O    |   | O                |     
 | X           O    |   | O                |     
 |                  |   | O                |    
^|                  |BAR|                  |     5 points match (Cube: 1)
 |                  |   |                  |    
 |                  |   | X                |     
 |                  |   | X                |     
 | O           X    |   | X        X       |     
 | O           X    |   | X  O     X  O    |     2 points
 +13-14-15-16-17-18------19-20-21-22-23-24-+     X: lasse
Pip counts: O 133, X 162

* klara moves 20/10

Cube analysis
2-ply cubeless equity +0.066 (Money: +0.112)
  0.536 0.155 0.004 - 0.464 0.115 0.004
Cubeful equities:
1. No double           +0.238
2. Double, pass        +1.000  (+0.762)
3. Double, take        +0.097  (-0.141)
Proper cube action: No double, take (15.6%)
Alert: very bad move ( -0.120)

Rolled 64:
     1. Cubeful 2-ply    8/2 6/2                      Eq.: +0.159
       0.510 0.175 0.004 - 0.490 0.139 0.005
*    2. Cubeful 2-ply    20/10                        Eq.: +0.038 (-0.120)
       0.489 0.145 0.003 - 0.511 0.155 0.006
     3. Cubeful 2-ply    20/16 8/2                    Eq.: +0.019 (-0.139)
       0.483 0.150 0.003 - 0.517 0.165 0.007
     4. Cubeful 2-ply    20/14 6/2                    Eq.: -0.023 (-0.182)
       0.470 0.153 0.004 - 0.530 0.175 0.007
     5. Cubeful 2-ply    20/14 8/4                    Eq.: -0.075 (-0.234)
       0.459 0.144 0.005 - 0.541 0.181 0.009


Move number 9:  lasse to play 62

 GNU Backgammon  Position ID: g88TAxCMZ/CADA
                 Match ID   : cAmrAAAAEAAE
 +13-14-15-16-17-18------19-20-21-22-23-24-+     O: klara
 | X     O     O    |   | O  X     X     O |     0 points
 | X           O    |   | O        X     O |     
 | X           O    |   | O                |     
 | X           O    |   | O                |     
 |                  |   | O                |    
v|                  |BAR|                  |     5 points match (Cube: 1)
 |                  |   |                  |    
 |                  |   | X                |     
 |                  |   | X                |     
 | O           X    |   | X        X       |     Rolled 62
 | O           X    |   | X        X  O    |     2 points
 +12-11-10--9--8--7-------6--5--4--3--2--1-+     X: lasse
Pip counts: O 123, X 162

* lasse moves 22/20 22/16

Cube analysis
2-ply cubeless equity +0.086 (Money: +0.035)
  0.511 0.155 0.006 - 0.489 0.145 0.003
Cubeful equities:
1. No double           -0.038
2. Double, pass        +1.000  (+1.038)
3. Double, take        -0.714  (-0.675)
Proper cube action: No double, take (39.4%)
Alert: bad move ( -0.069)

Rolled 62:
     1. Cubeful 2-ply    20/14 13/11                  Eq.: -0.246
       0.459 0.110 0.004 - 0.541 0.151 0.004
     2. Cubeful 2-ply    20/14 6/4                    Eq.: -0.298 (-0.051)
       0.451 0.111 0.004 - 0.549 0.169 0.004
*    3. Cubeful 2-ply    22/20 22/16                  Eq.: -0.315 (-0.069)
       0.429 0.097 0.004 - 0.571 0.132 0.003
     4. Cubeful 2-ply    22/20 13/7                   Eq.: -0.342 (-0.096)
       0.439 0.114 0.005 - 0.561 0.172 0.004
     5. Cubeful 2-ply    13/5                         Eq.: -0.353 (-0.107)
       0.450 0.119 0.005 - 0.550 0.198 0.006


Move number 10:  klara to play 63

 GNU Backgammon  Position ID: jGfwCAODzxMDEA
                 Match ID   : MAGvAAAAEAAE
 +12-11-10--9--8--7-------6--5--4--3--2--1-+     O: klara
 | X     O  X  O    |   | O  X           O |     0 points
 | X           O    |   | O  X           O |     Rolled 63
 | X           O    |   | O                |     
 | X           O    |   | O                |     
 |                  |   | O                |    
^|                  |BAR|                  |     5 points match (Cube: 1)
 |                  |   |                  |    
 |                  |   | X                |     
 |                  |   | X                |     
 | O           X    |   | X        X       |     
 | O           X    |   | X        X  O    |     2 points
 +13-14-15-16-17-18------19-20-21-22-23-24-+     X: lasse
Pip counts: O 123, X 154

* klara moves 23/20 10/4

Cube analysis
2-ply cubeless equity +0.137 (Money: +0.175)
  0.571 0.132 0.003 - 0.429 0.097 0.004
Cubeful equities:
1. No double           +0.315
2. Double, pass        +1.000  (+0.685)
3. Double, take        +0.205  (-0.110)
Proper cube action: No double, take (13.9%)

Rolled 63:
*    1. Cubeful 2-ply    23/20 10/4                   Eq.: +0.245
       0.549 0.145 0.004 - 0.451 0.119 0.003
     2. Cubeful 2-ply    10/4 6/3                     Eq.: +0.185 (-0.060)
       0.543 0.111 0.002 - 0.457 0.104 0.003
     3. Cubeful 2-ply    13/10 13/7                   Eq.: +0.154 (-0.090)
       0.526 0.125 0.002 - 0.474 0.107 0.004
     4. Cubeful 2-ply    10/7 8/2                     Eq.: +0.089 (-0.156)
       0.506 0.132 0.002 - 0.494 0.129 0.004
     5. Cubeful 2-ply    10/1                         Eq.: +0.014 (-0.231)
       0.494 0.105 0.002 - 0.506 0.132 0.004


Move number 11:  lasse to play 43

 GNU Backgammon  Position ID: I58HAwKMZ/AIAw
                 Match ID   : cAmuAAAAEAAE
 +13-14-15-16-17-18------19-20-21-22-23-24-+     O: klara
 | X        X  O    |   | O  X  O        O |     0 points
 | X           O    |   | O  X           O |     
 | X           O    |   | O                |     
 | X           O    |   | O                |     
 |                  |   | O                |    
v|                  |BAR|                  |     5 points match (Cube: 1)
 |                  |   |                  |    
 |                  |   | X                |     
 |                  |   | X                |     
 | O           X    |   | X        X       |     Rolled 43
 | O           X    |   | X  O     X       |     2 points
 +12-11-10--9--8--7-------6--5--4--3--2--1-+     X: lasse
Pip counts: O 114, X 154

* lasse moves 16/9

Cube analysis
2-ply cubeless equity -0.081 (Money: -0.124)
  0.451 0.119 0.003 - 0.549 0.145 0.004
Cubeful equities:
1. No double           -0.245
2. Double, pass        +1.000  (+1.245)
3. Double, take        -1.223  (-0.978)
Proper cube action: No double, take (44.0%)
Alert: very bad move ( -0.171)

Rolled 43:
     1. Cubeful 2-ply    13/9 8/5*                    Eq.: -0.435
       0.427 0.113 0.005 - 0.573 0.211 0.007
*    2. Cubeful 2-ply    16/9                         Eq.: -0.607 (-0.171)
       0.334 0.062 0.002 - 0.666 0.108 0.002
     3. Cubeful 2-ply    13/6                         Eq.: -0.610 (-0.175)
       0.335 0.064 0.002 - 0.665 0.113 0.002
     4. Cubeful 2-ply    8/5* 8/4                     Eq.: -0.659 (-0.224)
       0.385 0.100 0.005 - 0.615 0.221 0.006
     5. Cubeful 2-ply    13/10 13/9                   Eq.: -0.677 (-0.242)
       0.368 0.085 0.004 - 0.632 0.196 0.005


Move number 12:  klara to play 64

 GNU Backgammon  Position ID: jGfhAQMjnwcDAg
                 Match ID   : MAGzAAAAEAAE
 +12-11-10--9--8--7-------6--5--4--3--2--1-+     O: klara
 | X           O    |   | O  X  O        O |     0 points
 | X           O    |   | O  X           O |     Rolled 64
 | X           O    |   | O                |     
 | X           O    |   | O                |     
 |                  |   | O                |    
^|                  |BAR|                  |     5 points match (Cube: 1)
 |                  |   |                  |    
 |                  |   | X                |     
 |                  |   | X                |     
 | O           X    |   | X        X       |     
 | O        X  X    |   | X  O     X       |     2 points
 +13-14-15-16-17-18------19-20-21-22-23-24-+     X: lasse
Pip counts: O 114, X 147

* klara moves 20/14 8/4

Cube analysis
2-ply cubeless equity +0.349 (Money: +0.378)
  0.666 0.108 0.002 - 0.334 0.062 0.002
Cubeful equities:
1. No double           +0.607
2. Double, pass        +1.000  (+0.393)
3. Double, take        +0.594  (-0.013)
Proper cube action: No double, take (3.1%)

Rolled 64:
     1. Cubeful 2-ply    20/10                        Eq.: +0.660
       0.674 0.103 0.002 - 0.326 0.058 0.001
*    2. Cubeful 2-ply    20/14 8/4                    Eq.: +0.639 (-0.021)
       0.669 0.098 0.002 - 0.331 0.058 0.001
     3. Cubeful 2-ply    20/16*/10                    Eq.: +0.523 (-0.137)
       0.609 0.176 0.003 - 0.391 0.100 0.003
     4. Cubeful 2-ply    20/14 6/2                    Eq.: +0.479 (-0.181)
       0.634 0.087 0.001 - 0.366 0.077 0.002
     5. Cubeful 2-ply    20/16* 8/2                   Eq.: +0.328 (-0.332)
       0.560 0.155 0.003 - 0.440 0.132 0.005


Move number 13:  lasse to play 41

 GNU Backgammon  Position ID: Yz4HCwCMZ+EBAw
                 Match ID   : cAmmAAAAEAAE
 +13-14-15-16-17-18------19-20-21-22-23-24-+     O: klara
 | X           O    |   | O  X  O        O |     0 points
 | X           O    |   | O  X  O        O |     
 | X           O    |   | O                |     
 | X                |   | O                |     
 |                  |   | O                |    
v|                  |BAR|                  |     5 points match (Cube: 1)
 |                  |   |                  |    
 |                  |   | X                |     
 |                  |   | X                |     
 | O           X    |   | X        X       |     Rolled 41
 | O  O     X  X    |   | X        X       |     2 points
 +12-11-10--9--8--7-------6--5--4--3--2--1-+     X: lasse
Pip counts: O 104, X 147

* lasse moves 9/5 6/5

Cube analysis
2-ply cubeless equity -0.352 (Money: -0.378)
  0.331 0.058 0.001 - 0.669 0.098 0.002
Cubeful equities:
1. No double           -0.639
2. Double, pass        +1.000  (+1.639)
3. Double, take        -1.559  (-0.920)
Proper cube action: No double, take (35.9%)

Rolled 41:
*    1. Cubeful 2-ply    9/5 6/5                      Eq.: -0.841
       0.254 0.025 0.001 - 0.746 0.058 0.001
     2. Cubeful 2-ply    8/4 6/5                      Eq.: -0.900 (-0.058)
       0.244 0.022 0.001 - 0.756 0.063 0.001
     3. Cubeful 2-ply    13/9 6/5                     Eq.: -0.903 (-0.061)
       0.244 0.023 0.001 - 0.756 0.064 0.001
     4. Cubeful 2-ply    9/5 8/7                      Eq.: -0.939 (-0.097)
       0.234 0.021 0.001 - 0.766 0.059 0.001
     5. Cubeful 2-ply    8/7 8/4                      Eq.: -0.950 (-0.109)
       0.232 0.020 0.000 - 0.768 0.060 0.001


Move number 14:  klara on roll, cube decision?

 GNU Backgammon  Position ID: zM7gAQNjPgcLAA
                 Match ID   : MAGgAAAAEAAE
 +12-11-10--9--8--7-------6--5--4--3--2--1-+     O: klara
 | X           O    |   | O  X  O        O |     0 points
 | X           O    |   | O  X  O        O |     On roll
 | X           O    |   | O                |     
 | X                |   | O                |     
 |                  |   | O                |    
^|                  |BAR|                  |     5 points match (Cube: 1)
 |                  |   |                  |    
 |                  |   |                  |     
 |                  |   | X                |     
 | O           X    |   | X  X     X       |     
 | O  O        X    |   | X  X     X       |     2 points
 +13-14-15-16-17-18------19-20-21-22-23-24-+     X: lasse
Pip counts: O 104, X 142

* klara doubles


Cube analysis
2-ply cubeless equity +0.513 (Money: +0.526)
  0.746 0.058 0.001 - 0.254 0.025 0.001
Cubeful equities:
1. Double, take        +0.841
2. Double, pass        +1.000  (+0.159)
3. No double           +0.798  (-0.043)
Proper cube action: Double, take
Move number 15:  klara doubles to 2

 GNU Backgammon  Position ID: zM7gAQNjPgcLAA
                 Match ID   : MBmgAAAAEAAE
 +12-11-10--9--8--7-------6--5--4--3--2--1-+     O: klara
 | X           O    |   | O  X  O        O |     0 points
 | X           O    |   | O  X  O        O |     
 | X           O    |   | O                |     
 | X                |   | O                |     
 |                  |   | O                |    
^|                  |BAR|                  |     
 |                  |   |                  |    
 |                  |   |                  |     
 |                  |   | X                |     
 | O           X    |   | X  X     X       |     Cube offered at 2
 | O  O        X    |   | X  X     X       |     2 points
 +13-14-15-16-17-18------19-20-21-22-23-24-+     X: lasse
Pip counts: O 104, X 142

* lasse accepts


Cube analysis
2-ply cubeless equity -0.513 (Money: -0.526)
  0.254 0.025 0.001 - 0.746 0.058 0.001
Cubeful equities:
1. Double, take        -0.841
2. Double, pass        -1.000  (-0.159)
3. No double           -0.798  (+0.043)
Proper cube action: Double, take
Move number 16:  klara to play 63

 GNU Backgammon  Position ID: zM7gAQNjPgcLAA
                 Match ID   : EQGvAAAAEAAE
 +12-11-10--9--8--7-------6--5--4--3--2--1-+     O: klara
 | X           O    |   | O  X  O        O |     0 points
 | X           O    |   | O  X  O        O |     Rolled 63
 | X           O    |   | O                |     
 | X                |   | O                |     
 |                  |   | O                |    
^|                  |BAR|                  |     5 points match
 |                  |   |                  |    
 |                  |   |                  |     
 |                  |   | X                |     
 | O           X    |   | X  X     X       |     
 | O  O        X    |   | X  X     X       |     2 points
 +13-14-15-16-17-18------19-20-21-22-23-24-+     X: lasse (Cube: 2)
Pip counts: O 104, X 142

* klara moves 14/8 6/3

Rolled 63:
*    1. Cubeful 2-ply    14/8 6/3                     Eq.: +0.532
       0.762 0.053 0.000 - 0.238 0.022 0.000
     2. Cubeful 2-ply    14/8 4/1                     Eq.: +0.483 (-0.049)
       0.743 0.050 0.000 - 0.257 0.029 0.000
     3. Cubeful 0-ply    14/11 8/2                    Eq.: +0.154 (-0.378)
       0.584 0.085 0.001 - 0.416 0.071 0.000
     4. Cubeful 0-ply    8/2 6/3                      Eq.: +0.119 (-0.413)
       0.571 0.081 0.001 - 0.429 0.077 0.001
     5. Cubeful 0-ply    8/2 4/1                      Eq.: -0.052 (-0.584)
       0.507 0.072 0.001 - 0.493 0.110 0.002


Move number 17:  lasse to play 64

 GNU Backgammon  Position ID: 0zwPBgDMzuABAw
                 Match ID   : UQmzAAAAEAAE
 +13-14-15-16-17-18------19-20-21-22-23-24-+     O: klara
 | X           O    |   | O  X  O  O     O |     0 points
 | X           O    |   | O  X  O        O |     
 | X           O    |   | O                |     
 | X           O    |   | O                |     
 |                  |   |                  |    
v|                  |BAR|                  |     5 points match
 |                  |   |                  |    
 |                  |   |                  |     
 |                  |   | X                |     
 | O           X    |   | X  X     X       |     Rolled 64
 | O           X    |   | X  X     X       |     2 points
 +12-11-10--9--8--7-------6--5--4--3--2--1-+     X: lasse (Cube: 2)
Pip counts: O 95, X 142

* lasse moves 13/9 13/7

Cube analysis
2-ply cubeless equity -0.582 (Money: -0.556)
  0.238 0.022 0.000 - 0.762 0.053 0.000
Cubeful equities:
1. No double           -0.532
2. Double, pass        +1.000  (+1.532)
3. Double, take        -2.467  (-1.935)
Proper cube action: No redouble, take (55.8%)

Rolled 64:
     1. Cubeful 2-ply    13/7 8/4                     Eq.: -0.477
       0.256 0.021 0.000 - 0.744 0.044 0.000
*    2. Cubeful 2-ply    13/9 13/7                    Eq.: -0.496 (-0.018)
       0.249 0.019 0.000 - 0.751 0.045 0.000
     3. Cubeful 2-ply    8/2 6/2                      Eq.: -0.528 (-0.051)
       0.239 0.017 0.000 - 0.761 0.051 0.000
     4. Cubeful 2-ply    13/7 6/2                     Eq.: -0.530 (-0.052)
       0.238 0.018 0.000 - 0.762 0.051 0.000
     5. Cubeful 2-ply    13/9 8/2                     Eq.: -0.532 (-0.055)
       0.237 0.019 0.000 - 0.763 0.052 0.000


Move number 18:  klara to play 51

 GNU Backgammon  Position ID: zK6FAQPTPA8GAA
                 Match ID   : EYGmAAAAEAAE
 +12-11-10--9--8--7-------6--5--4--3--2--1-+     O: klara
 | X           O    |   | O  X  O  O     O |     0 points
 | X           O    |   | O  X  O        O |     Rolled 51
 |             O    |   | O                |     
 |             O    |   | O                |     
 |                  |   |                  |    
^|                  |BAR|                  |     5 points match
 |                  |   |                  |    
 |                  |   |                  |     
 |                  |   | X                |     
 | O           X    |   | X  X     X       |     
 | O        X  X  X |   | X  X     X       |     2 points
 +13-14-15-16-17-18------19-20-21-22-23-24-+     X: lasse (Cube: 2)
Pip counts: O 95, X 132

* klara moves 8/2

Rolled 51:
*    1. Cubeful 2-ply    8/2                          Eq.: +0.451
       0.734 0.042 0.000 - 0.266 0.023 0.000
     2. Cubeful 2-ply    8/3 4/3                      Eq.: +0.425 (-0.026)
       0.722 0.044 0.000 - 0.278 0.027 0.000
     3. Cubeful 2-ply    8/7 8/3                      Eq.: +0.421 (-0.030)
       0.680 0.114 0.003 - 0.320 0.048 0.001
     4. Cubeful 2-ply    6/1 4/3                      Eq.: +0.412 (-0.040)
       0.718 0.040 0.000 - 0.282 0.028 0.000
     5. Cubeful 2-ply    6/1 3/2                      Eq.: +0.410 (-0.041)
       0.718 0.039 0.000 - 0.282 0.028 0.000


Move number 19:  lasse to play 32

 GNU Backgammon  Position ID: q3kOBgDMroUBAw
                 Match ID   : UYmpAAAAEAAE
 +13-14-15-16-17-18------19-20-21-22-23-24-+     O: klara
 | X           O    |   | O  X  O  O  O  O |     0 points
 | X           O    |   | O  X  O        O |     
 |             O    |   | O                |     
 |                  |   | O                |     
 |                  |   |                  |    
v|                  |BAR|                  |     5 points match
 |                  |   |                  |    
 |                  |   |                  |     
 |                  |   | X                |     
 | O           X    |   | X  X     X       |     Rolled 32
 | O        X  X  X |   | X  X     X       |     2 points
 +12-11-10--9--8--7-------6--5--4--3--2--1-+     X: lasse (Cube: 2)
Pip counts: O 89, X 132

* lasse moves 7/4 6/4

Cube analysis
2-ply cubeless equity -0.508 (Money: -0.487)
  0.266 0.023 0.000 - 0.734 0.042 0.000
Cubeful equities:
1. No double           -0.451
2. Double, pass        +1.000  (+1.451)
3. Double, take        -2.366  (-1.914)
Proper cube action: No redouble, take (56.9%)

Rolled 32:
*    1. Cubeful 2-ply    7/4 6/4                      Eq.: -0.426
       0.278 0.023 0.000 - 0.722 0.043 0.000
     2. Cubeful 2-ply    8/5 6/4                      Eq.: -0.430 (-0.004)
       0.277 0.024 0.000 - 0.723 0.045 0.000
     3. Cubeful 2-ply    9/4                          Eq.: -0.438 (-0.013)
       0.274 0.024 0.000 - 0.726 0.046 0.000
     4. Cubeful 2-ply    9/7 8/5                      Eq.: -0.457 (-0.031)
       0.267 0.022 0.000 - 0.733 0.047 0.000
     5. Cubeful 2-ply    8/6 7/4                      Eq.: -0.463 (-0.037)
       0.265 0.023 0.000 - 0.735 0.048 0.001


Move number 20:  klara to play 44

 GNU Backgammon  Position ID: bJuFAQOreQ4GAA
                 Match ID   : EQGyAAAAEAAE
 +12-11-10--9--8--7-------6--5--4--3--2--1-+     O: klara
 | X           O    |   | O  X  O  O  O  O |     0 points
 | X           O    |   | O  X  O        O |     Rolled 44
 |             O    |   | O                |     
 |                  |   | O                |     
 |                  |   |                  |    
^|                  |BAR|                  |     5 points match
 |                  |   |                  |    
 |                  |   |                  |     
 |                  |   |                  |     
 | O           X    |   | X  X  X  X       |     
 | O        X  X    |   | X  X  X  X       |     2 points
 +13-14-15-16-17-18------19-20-21-22-23-24-+     X: lasse (Cube: 2)
Pip counts: O 89, X 127

* klara moves 13/9(2) 8/4 6/2

Rolled 44:
*    1. Cubeful 2-ply    13/9(2) 8/4 6/2              Eq.: +0.719
       0.854 0.035 0.000 - 0.146 0.007 0.000
     2. Cubeful 2-ply    13/9(2) 6/2(2)               Eq.: +0.618 (-0.101)
       0.810 0.035 0.000 - 0.190 0.012 0.000
     3. Cubeful 0-ply    13/9(2) 8/4(2)               Eq.: +0.147 (-0.572)
       0.590 0.066 0.000 - 0.410 0.057 0.000
     4. Cubeful 0-ply    8/4(3) 6/2                   Eq.: +0.145 (-0.573)
       0.584 0.074 0.000 - 0.416 0.051 0.000
     5. Cubeful 0-ply    6/2(4)                       Eq.: -0.024 (-0.742)
       0.527 0.053 0.000 - 0.473 0.082 0.000


Move number 21:  lasse to play 64

 GNU Backgammon  Position ID: W+dsAABsm4UBAw
                 Match ID   : UQmzAAAAEAAE
 +13-14-15-16-17-18------19-20-21-22-23-24-+     O: klara
 | X        O  O    |   | O  X  O  O  O  O |     0 points
 | X        O  O    |   | O  X  O     O  O |     
 |                  |   | O     O          |     
 |                  |   |                  |     
 |                  |   |                  |    
v|                  |BAR|                  |     5 points match
 |                  |   |                  |    
 |                  |   |                  |     
 |                  |   |                  |     
 |             X    |   | X  X  X  X       |     Rolled 64
 |          X  X    |   | X  X  X  X       |     2 points
 +12-11-10--9--8--7-------6--5--4--3--2--1-+     X: lasse (Cube: 2)
Pip counts: O 73, X 127

* lasse moves 9/5 8/2

Cube analysis
2-ply cubeless equity -0.753 (Money: -0.736)
  0.146 0.007 0.000 - 0.854 0.035 0.000
Cubeful equities:
1. No double           -0.719
2. Double, pass        +1.000  (+1.719)
3. Double, take        -2.467  (-1.749)
Proper cube action: No redouble, take (50.4%)

Rolled 64:
     1. Cubeful 2-ply    13/7 9/5                     Eq.: -0.690
       0.154 0.005 0.000 - 0.846 0.027 0.000
     2. Cubeful 2-ply    13/9 13/7                    Eq.: -0.692 (-0.002)
       0.153 0.005 0.000 - 0.847 0.027 0.000
     3. Cubeful 2-ply    13/7 8/4                     Eq.: -0.696 (-0.007)
       0.152 0.005 0.000 - 0.848 0.028 0.000
     4. Cubeful 2-ply    13/9 8/2                     Eq.: -0.707 (-0.017)
       0.149 0.006 0.000 - 0.851 0.032 0.000
*    5. Cubeful 2-ply    9/5 8/2                      Eq.: -0.708 (-0.018)
       0.151 0.006 0.000 - 0.849 0.034 0.000


Move number 22:  klara to play 53

 GNU Backgammon  Position ID: 2m6CAQNb52wAAA
                 Match ID   : EYGuAAAAEAAE
 +12-11-10--9--8--7-------6--5--4--3--2--1-+     O: klara
 | X        O  O    |   | O  X  O  O  O  O |     0 points
 | X        O  O    |   | O  X  O     O  O |     Rolled 53
 |                  |   | O     O          |     
 |                  |   |                  |     
 |                  |   |                  |    
^|                  |BAR|                  |     5 points match
 |                  |   |                  |    
 |                  |   |                  |     
 |                  |   |    X             |     
 |                  |   | X  X  X  X       |     
 |             X    |   | X  X  X  X  X    |     2 points
 +13-14-15-16-17-18------19-20-21-22-23-24-+     X: lasse (Cube: 2)
Pip counts: O 73, X 117

* klara moves 9/6 9/4

Rolled 53:
*    1. Cubeful 2-ply    9/6 9/4                      Eq.: +0.830
       0.904 0.033 0.000 - 0.096 0.003 0.000
     2. Cubeful 2-ply    6/1 4/1                      Eq.: +0.618 (-0.211)
       0.814 0.029 0.000 - 0.186 0.010 0.000
     3. Cubeful 0-ply    9/4 6/3                      Eq.: +0.375 (-0.455)
       0.682 0.073 0.000 - 0.318 0.028 0.000
     4. Cubeful 0-ply    9/1                          Eq.: +0.362 (-0.468)
       0.680 0.068 0.000 - 0.320 0.035 0.000
     5. Cubeful 0-ply    8/3 4/1                      Eq.: +0.307 (-0.523)
       0.653 0.072 0.000 - 0.347 0.034 0.000


Move number 23:  lasse to play 55

 GNU Backgammon  Position ID: W88zAADaboIBAw
                 Match ID   : UYm2AAAAEAAE
 +13-14-15-16-17-18------19-20-21-22-23-24-+     O: klara
 | X           O    |   | O  X  O  O  O  O |     0 points
 | X           O    |   | O  X  O     O  O |     
 |                  |   | O     O          |     
 |                  |   | O     O          |     
 |                  |   |                  |    
v|                  |BAR|                  |     5 points match
 |                  |   |                  |    
 |                  |   |                  |     
 |                  |   |    X             |     
 |                  |   | X  X  X  X       |     Rolled 55
 |             X    |   | X  X  X  X  X    |     2 points
 +12-11-10--9--8--7-------6--5--4--3--2--1-+     X: lasse (Cube: 2)
Pip counts: O 65, X 117

* lasse moves 13/3(2)

Cube analysis
2-ply cubeless equity -0.853 (Money: -0.838)
  0.096 0.003 0.000 - 0.904 0.033 0.000
Cubeful equities:
1. No double           -0.830
2. Double, pass        +1.000  (+1.830)
3. Double, take        -2.467  (-1.638)
Proper cube action: No redouble, take (47.2%)

Rolled 55:
*    1. Cubeful 2-ply    13/3(2)                      Eq.: -0.785
       0.107 0.002 0.000 - 0.893 0.018 0.000
     2. Cubeful 2-ply    20/10 13/8(2)                Eq.: -0.822 (-0.037)
       0.099 0.003 0.000 - 0.901 0.031 0.000
     3. Cubeful 2-ply    20/5 13/8                    Eq.: -0.825 (-0.040)
       0.098 0.003 0.000 - 0.902 0.032 0.000
     4. Cubeful 2-ply    20/10 13/3                   Eq.: -0.828 (-0.044)
       0.100 0.003 0.000 - 0.900 0.037 0.000
     5. Cubeful 2-ply    13/3 13/8 6/1                Eq.: -0.831 (-0.047)
       0.091 0.001 0.000 - 0.909 0.026 0.000


Move number 24:  klara to play 42

 GNU Backgammon  Position ID: ersJAANbzzMAAA
                 Match ID   : EQGqAAAAEAAE
 +12-11-10--9--8--7-------6--5--4--3--2--1-+     O: klara
 |             O    |   | O  X  O  O  O  O |     0 points
 |             O    |   | O  X  O     O  O |     Rolled 42
 |                  |   | O     O          |     
 |                  |   | O     O          |     
 |                  |   |                  |    
^|                  |BAR|                  |     5 points match
 |                  |   |                  |    
 |                  |   |          X       |     
 |                  |   |    X     X       |     
 |                  |   | X  X  X  X       |     
 |             X    |   | X  X  X  X  X    |     2 points
 +13-14-15-16-17-18------19-20-21-22-23-24-+     X: lasse (Cube: 2)
Pip counts: O 65, X 97

* klara moves 8/6 8/4

Rolled 42:
*    1. Cubeful 2-ply    8/6 8/4                      Eq.: +0.880
       0.936 0.016 0.000 - 0.064 0.000 0.000
     2. Cubeful 2-ply    6/2 4/2                      Eq.: +0.719 (-0.160)
       0.866 0.016 0.000 - 0.134 0.002 0.000
     3. Cubeful 2-ply    6/4 6/2                      Eq.: +0.705 (-0.175)
       0.861 0.013 0.000 - 0.139 0.003 0.000
     4. Cubeful 2-ply    6/2 3/1                      Eq.: +0.690 (-0.189)
       0.855 0.013 0.000 - 0.145 0.003 0.000
     5. Cubeful 0-ply    8/2                          Eq.: +0.422 (-0.458)
       0.728 0.027 0.000 - 0.272 0.009 0.000


Move number 25:  lasse to play 65

 GNU Backgammon  Position ID: W58PAAB6uwkAAw
                 Match ID   : UQm3AAAAEAAE
 +13-14-15-16-17-18------19-20-21-22-23-24-+     O: klara
 |                  |   | O  X  O  O  O  O |     0 points
 |                  |   | O  X  O     O  O |     
 |                  |   | O     O          |     
 |                  |   | O     O          |     
 |                  |   | O     O          |    
v|                  |BAR|                  |     5 points match
 |                  |   |                  |    
 |                  |   |          X       |     
 |                  |   |    X     X       |     
 |                  |   | X  X  X  X       |     Rolled 65
 |             X    |   | X  X  X  X  X    |     2 points
 +12-11-10--9--8--7-------6--5--4--3--2--1-+     X: lasse (Cube: 2)
Pip counts: O 59, X 97

* lasse moves 20/9

Cube analysis
2-ply cubeless equity -0.896 (Money: -0.888)
  0.064 0.000 0.000 - 0.936 0.016 0.000
Cubeful equities:
1. No double           -0.880
2. Double, pass        +1.000  (+1.880)
3. Double, take        -2.467  (-1.588)
Proper cube action: No redouble, take (45.8%)

Rolled 65:
*    1. Cubeful 2-ply    20/9                         Eq.: -0.876
       0.061 0.000 0.000 - 0.939 0.009 0.000
     2. Cubeful 2-ply    20/15 8/2                    Eq.: -0.880 (-0.005)
       0.062 0.000 0.000 - 0.938 0.013 0.000
     3. Cubeful 2-ply    20/14 8/3                    Eq.: -0.890 (-0.015)
       0.057 0.000 0.000 - 0.943 0.013 0.000
     4. Cubeful 2-ply    20/14 6/1                    Eq.: -0.905 (-0.030)
       0.060 0.001 0.000 - 0.940 0.028 0.000
     5. Cubeful 2-ply    8/2 6/1                      Eq.: -0.908 (-0.032)
       0.051 0.000 0.000 - 0.949 0.016 0.000


Move number 26:  klara to play 32

 GNU Backgammon  Position ID: erspAAJbnw8AAA
                 Match ID   : EYGpAAAAEAAE
 +12-11-10--9--8--7-------6--5--4--3--2--1-+     O: klara
 |                  |   | O  X  O  O  O  O |     0 points
 |                  |   | O     O     O  O |     Rolled 32
 |                  |   | O     O          |     
 |                  |   | O     O          |     
 |                  |   | O     O          |    
^|                  |BAR|                  |     5 points match
 |                  |   |                  |    
 |                  |   |          X       |     
 |                  |   |    X     X       |     
 |                  |   | X  X  X  X       |     
 |          X  X    |   | X  X  X  X  X    |     2 points
 +13-14-15-16-17-18------19-20-21-22-23-24-+     X: lasse (Cube: 2)
Pip counts: O 59, X 86

* klara moves 6/3 2/off

Rolled 32:
*    1. Cubeful 2-ply    6/3 2/off                    Eq.: +0.879
       0.944 0.003 0.000 - 0.056 0.000 0.000
     2. Cubeful 2-ply    3/off 2/off                  Eq.: +0.866 (-0.013)
       0.939 0.002 0.000 - 0.061 0.000 0.000
     3. Cubeful 2-ply    6/3 4/2                      Eq.: +0.864 (-0.015)
       0.936 0.005 0.000 - 0.064 0.000 0.000
     4. Cubeful 2-ply    6/4 3/off                    Eq.: +0.860 (-0.019)
       0.936 0.003 0.000 - 0.064 0.000 0.000
     5. Cubeful 2-ply    4/1 2/off                    Eq.: +0.848 (-0.031)
       0.931 0.001 0.000 - 0.069 0.000 0.000


Move number 27:  lasse to play 43

 GNU Backgammon  Position ID: a58HAAC93RQAAQ
                 Match ID   : UQmuAAAAEAAE
 +13-14-15-16-17-18------19-20-21-22-23-24-+     O: klara
 |                  |   | O  X  O  O  O  O | O   0 points
 |                  |   | O     O  O     O |     
 |                  |   | O     O          |     
 |                  |   | O     O          |     
 |                  |   |       O          |    
v|                  |BAR|                  |     5 points match
 |                  |   |                  |    
 |                  |   |          X       |     
 |                  |   |    X     X       |     
 |                  |   | X  X  X  X       |     Rolled 43
 |          X  X    |   | X  X  X  X  X    |     2 points
 +12-11-10--9--8--7-------6--5--4--3--2--1-+     X: lasse (Cube: 2)
Pip counts: O 54, X 86

* lasse moves 8/4 5/2

Cube analysis
2-ply cubeless equity -0.893 (Money: -0.891)
  0.056 0.000 0.000 - 0.944 0.003 0.000
Cubeful equities:
1. No double           -0.879
2. Double, pass        +1.000  (+1.879)
3. Double, take        -2.467  (-1.588)
Proper cube action: No redouble, take (45.8%)

Rolled 43:
     1. Cubeful 2-ply    9/6 8/4                      Eq.: -0.903
       0.045 0.000 0.000 - 0.955 0.003 0.000
     2. Cubeful 2-ply    9/5 8/5                      Eq.: -0.907 (-0.003)
       0.044 0.000 0.000 - 0.956 0.003 0.000
     3. Cubeful 2-ply    8/1                          Eq.: -0.911 (-0.008)
       0.043 0.000 0.000 - 0.957 0.005 0.000
     4. Cubeful 2-ply    9/6 5/1                      Eq.: -0.912 (-0.008)
       0.042 0.000 0.000 - 0.958 0.005 0.000
     5. Cubeful 2-ply    20/16 9/6                    Eq.: -0.914 (-0.010)
       0.039 0.000 0.000 - 0.961 0.000 0.000
*    8. Cubeful 2-ply    8/4 5/2                      Eq.: -0.916 (-0.012)
       0.042 0.000 0.000 - 0.958 0.007 0.000


Move number 28:  klara to play 65

 GNU Backgammon  Position ID: 9m4jAAJrnwcAAA
                 Match ID   : EQG3AAAAEAAE
 +12-11-10--9--8--7-------6--5--4--3--2--1-+     O: klara
 |                  |   | O  X  O  O  O  O | O   0 points
 |                  |   | O     O  O     O |     Rolled 65
 |                  |   | O     O          |     
 |                  |   | O     O          |     
 |                  |   |       O          |    
^|                  |BAR|                  |     5 points match
 |                  |   |                  |    
 |                  |   |          X       |     
 |                  |   |       X  X       |     
 |                  |   | X  X  X  X  X    |     
 |          X       |   | X  X  X  X  X    |     2 points
 +13-14-15-16-17-18------19-20-21-22-23-24-+     X: lasse (Cube: 2)
Pip counts: O 54, X 79

* klara moves 6/1 6/off

Rolled 65:
*    1. Cubeful 0-ply    6/1 6/off                    Eq.: +0.900
       0.954 0.003 0.000 - 0.046 0.000 0.000


Move number 29:  lasse to play 32

 GNU Backgammon  Position ID: 1z4DAIC92wiAAA
                 Match ID   : UYmpAAAAEAAE
 +13-14-15-16-17-18------19-20-21-22-23-24-+     O: klara
 |                  |   | O  X  O  O  O  O | O   0 points
 |                  |   | O     O  O     O | O   
 |                  |   |       O        O |     
 |                  |   |       O          |     
 |                  |   |       O          |    
v|                  |BAR|                  |     5 points match
 |                  |   |                  |    
 |                  |   |          X       |     
 |                  |   |       X  X       |     
 |                  |   | X  X  X  X  X    |     Rolled 32
 |          X       |   | X  X  X  X  X    |     2 points
 +12-11-10--9--8--7-------6--5--4--3--2--1-+     X: lasse (Cube: 2)
Pip counts: O 43, X 79

* lasse moves 4/1 3/1

Cube analysis
2-ply cubeless equity -0.913 (Money: -0.913)
  0.045 0.000 0.000 - 0.955 0.002 0.000
Cubeful equities:
1. No double           -0.902
2. Double, pass        +1.000  (+1.902)
3. Double, take        -2.467  (-1.565)
Proper cube action: No redouble, take (45.1%)

Rolled 32:
     1. Cubeful 2-ply    9/6 3/1                      Eq.: -0.907
       0.043 0.000 0.000 - 0.957 0.002 0.000
     2. Cubeful 2-ply    9/4                          Eq.: -0.913 (-0.006)
       0.040 0.000 0.000 - 0.960 0.002 0.000
*    3. Cubeful 2-ply    4/1 3/1                      Eq.: -0.914 (-0.008)
       0.042 0.000 0.000 - 0.958 0.004 0.000
     4. Cubeful 2-ply    9/6 4/2                      Eq.: -0.915 (-0.009)
       0.039 0.000 0.000 - 0.961 0.002 0.000
     5. Cubeful 2-ply    9/7 4/1                      Eq.: -0.917 (-0.011)
       0.039 0.000 0.000 - 0.961 0.003 0.000


Move number 30:  klara to play 64

 GNU Backgammon  Position ID: 220jAALXPgMAAA
                 Match ID   : EQGzAAAAEAAE
 +12-11-10--9--8--7-------6--5--4--3--2--1-+     O: klara
 |                  |   | O  X  O  O  O  O | O   0 points
 |                  |   | O     O  O     O | O   Rolled 64
 |                  |   |       O        O |     
 |                  |   |       O          |     
 |                  |   |       O          |    
^|                  |BAR|                  |     5 points match
 |                  |   |                  |    
 |                  |   |                  |     
 |                  |   |          X       |     
 |                  |   | X  X  X  X  X  X |     
 |          X       |   | X  X  X  X  X  X |     2 points
 +13-14-15-16-17-18------19-20-21-22-23-24-+     X: lasse (Cube: 2)
Pip counts: O 43, X 74

* klara moves 6/2 6/off

Rolled 64:
*    1. Cubeful 0-ply    6/2 6/off                    Eq.: +0.995
       0.997 0.001 0.000 - 0.003 0.000 0.000
     2. Cubeful 0-ply    6/off 4/off                  Eq.: +0.418 (-0.577)
       0.734 0.013 0.000 - 0.266 0.000 0.000


Move number 31:  lasse to play 22

 GNU Backgammon  Position ID: t30AAGC7bQRAAA
                 Match ID   : UQmpAAAAEAAE
 +13-14-15-16-17-18------19-20-21-22-23-24-+     O: klara
 |                  |   |    X  O  O  O  O | O   0 points
 |                  |   |       O  O  O  O | O   
 |                  |   |       O        O | O   
 |                  |   |       O          |     
 |                  |   |       O          |    
v|                  |BAR|                  |     5 points match
 |                  |   |                  |    
 |                  |   |                  |     
 |                  |   |          X       |     
 |                  |   | X  X  X  X  X  X |     Rolled 22
 |          X       |   | X  X  X  X  X  X |     2 points
 +12-11-10--9--8--7-------6--5--4--3--2--1-+     X: lasse (Cube: 2)
Pip counts: O 33, X 74

* lasse moves 20/12

Cube analysis
2-ply cubeless equity -0.995 (Money: -0.995)
  0.003 0.000 0.000 - 0.997 0.001 0.000
Cubeful equities:
1. No double           -0.994
2. Double, pass        +1.000  (+1.994)
3. Double, take        -2.468  (-1.474)
Proper cube action: No redouble, take (42.5%)

Rolled 22:
*    1. Cubeful 2-ply    20/12                        Eq.: -0.996
       0.002 0.000 0.000 - 0.998 0.000 0.000
     2. Cubeful 2-ply    20/16 9/5                    Eq.: -0.996 (-0.000)
       0.002 0.000 0.000 - 0.998 0.000 0.000
     3. Cubeful 2-ply    20/14 9/7                    Eq.: -0.996 (-0.001)
       0.002 0.000 0.000 - 0.998 0.000 0.000
     4. Cubeful 2-ply    20/14 6/4                    Eq.: -0.997 (-0.001)
       0.002 0.000 0.000 - 0.998 0.001 0.000
     5. Cubeful 2-ply    20/18 9/5 6/4                Eq.: -0.997 (-0.001)
       0.002 0.000 0.000 - 0.998 0.001 0.000


Move number 32:  klara to play 32

 GNU Backgammon  Position ID: 220jAgC3fQAAAA
                 Match ID   : EYGpAAAAEAAE
 +12-11-10--9--8--7-------6--5--4--3--2--1-+     O: klara
 |                  |   |       O  O  O  O | O   0 points
 |                  |   |       O  O  O  O | O   Rolled 32
 |                  |   |       O        O | O   
 |                  |   |       O          |     
 |                  |   |       O          |    
^|                  |BAR|                  |     5 points match
 |                  |   |                  |    
 |                  |   |                  |     
 |                  |   |          X       |     
 |                  |   | X  X  X  X  X  X |     
 | X        X       |   | X  X  X  X  X  X |     2 points
 +13-14-15-16-17-18------19-20-21-22-23-24-+     X: lasse (Cube: 2)
Pip counts: O 33, X 66

* klara moves 3/off 2/off

Rolled 32:
*    1. Cubeful 2-ply    3/off 2/off                  Eq.: +0.992
       0.996 0.000 0.000 - 0.004 0.000 0.000
     2. Cubeful 2-ply    4/2 3/off                    Eq.: +0.988 (-0.003)
       0.995 0.000 0.000 - 0.005 0.000 0.000
     3. Cubeful 2-ply    4/1 2/off                    Eq.: +0.988 (-0.004)
       0.994 0.000 0.000 - 0.006 0.000 0.000
     4. Cubeful 2-ply    4/2 4/1                      Eq.: +0.985 (-0.006)
       0.993 0.000 0.000 - 0.007 0.000 0.000
     5. Cubeful 2-ply    3/1 3/off                    Eq.: +0.973 (-0.019)
       0.988 0.000 0.000 - 0.012 0.000 0.000


Move number 33:  lasse to play 21

 GNU Backgammon  Position ID: Vx8AANhuGxEAAA
                 Match ID   : UQmlAAAAEAAE
 +13-14-15-16-17-18------19-20-21-22-23-24-+     O: klara
 |                  |   |       O  O  O  O | O   0 points
 |                  |   |       O        O | O   
 |                  |   |       O        O | O   
 |                  |   |       O          | O   
 |                  |   |       O          | O  
v|                  |BAR|                  |     5 points match
 |                  |   |                  |    
 |                  |   |                  |     
 |                  |   |          X       |     
 |                  |   | X  X  X  X  X  X |     Rolled 21
 | X        X       |   | X  X  X  X  X  X |     2 points
 +12-11-10--9--8--7-------6--5--4--3--2--1-+     X: lasse (Cube: 2)
Pip counts: O 28, X 66

* lasse moves 9/6

Cube analysis
2-ply cubeless equity -0.993 (Money: -0.993)
  0.004 0.000 0.000 - 0.996 0.000 0.000
Cubeful equities:
1. No double           -0.992
2. Double, pass        +1.000  (+1.992)
3. Double, take        -2.467  (-1.476)
Proper cube action: No redouble, take (42.6%)

Rolled 21:
*    1. Cubeful 2-ply    9/6                          Eq.: -0.999
       0.001 0.000 0.000 - 0.999 0.000 0.000
     2. Cubeful 2-ply    12/10 9/8                    Eq.: -0.999 (-0.001)
       0.000 0.000 0.000 - 1.000 0.000 0.000
     3. Cubeful 2-ply    12/11 9/7                    Eq.: -0.999 (-0.001)
       0.000 0.000 0.000 - 1.000 0.000 0.000
     4. Cubeful 2-ply    12/9                         Eq.: -0.999 (-0.001)
       0.000 0.000 0.000 - 1.000 0.000 0.000
     5. Cubeful 2-ply    12/10 6/5                    Eq.: -1.000 (-0.001)
       0.000 0.000 0.000 - 1.000 0.001 0.000


Move number 34:  klara to play 31

 GNU Backgammon  Position ID: 220HAgBXHwAAAA
                 Match ID   : EYGlAAAAEAAE
 +12-11-10--9--8--7-------6--5--4--3--2--1-+     O: klara
 |                  |   |       O  O  O  O | O   0 points
 |                  |   |       O        O | O   Rolled 31
 |                  |   |       O        O | O   
 |                  |   |       O          | O   
 |                  |   |       O          | O  
^|                  |BAR|                  |     5 points match
 |                  |   |                  |    
 |                  |   |                  |     
 |                  |   | X        X       |     
 |                  |   | X  X  X  X  X  X |     
 | X                |   | X  X  X  X  X  X |     2 points
 +13-14-15-16-17-18------19-20-21-22-23-24-+     X: lasse (Cube: 2)
Pip counts: O 28, X 63

* klara moves 3/off 1/off

Rolled 31:
*    1. Cubeful 2-ply    3/off 1/off                  Eq.: +0.996
       0.998 0.000 0.000 - 0.002 0.000 0.000
     2. Cubeful 2-ply    4/off                        Eq.: +0.996 (-0.000)
       0.998 0.000 0.000 - 0.002 0.000 0.000
     3. Cubeful 2-ply    4/3 4/1                      Eq.: +0.992 (-0.004)
       0.997 0.000 0.000 - 0.003 0.000 0.000
     4. Cubeful 2-ply    3/off 2/1                    Eq.: +0.986 (-0.010)
       0.994 0.000 0.000 - 0.006 0.000 0.000
     5. Cubeful 2-ply    4/1 3/2                      Eq.: +0.984 (-0.012)
       0.993 0.000 0.000 - 0.007 0.000 0.000


Move number 35:  lasse to play 31

 GNU Backgammon  Position ID: ywcAALbbDgQAAA
                 Match ID   : UYmlAAAAEAAE
 +13-14-15-16-17-18------19-20-21-22-23-24-+     O: klara
 |                  |   |       O     O  O | OO  0 points
 |                  |   |       O        O | OO  
 |                  |   |       O          | O   
 |                  |   |       O          | O   
 |                  |   |       O          | O  
v|                  |BAR|                  |     5 points match
 |                  |   |                  |    
 |                  |   |                  |     
 |                  |   | X        X       |     
 |                  |   | X  X  X  X  X  X |     Rolled 31
 | X                |   | X  X  X  X  X  X |     2 points
 +12-11-10--9--8--7-------6--5--4--3--2--1-+     X: lasse (Cube: 2)
Pip counts: O 24, X 63

* lasse moves 12/8

Cube analysis
2-ply cubeless equity -0.997 (Money: -0.997)
  0.002 0.000 0.000 - 0.998 0.000 0.000
Cubeful equities:
1. No double           -0.996
2. Double, pass        +1.000  (+1.996)
3. Double, take        -2.467  (-1.471)
Proper cube action: No redouble, take (42.4%)

Rolled 31:
*    1. Cubeful 2-ply    12/8                         Eq.: -1.000
       0.000 0.000 0.000 - 1.000 0.000 0.000
     2. Cubeful 2-ply    12/9 6/5                     Eq.: -1.000 (-0.001)
       0.000 0.000 0.000 - 1.000 0.000 0.000
     3. Cubeful 2-ply    12/9 5/4                     Eq.: -1.000 (-0.001)
       0.000 0.000 0.000 - 1.000 0.000 0.000
     4. Cubeful 2-ply    12/9 4/3                     Eq.: -1.000 (-0.001)
       0.000 0.000 0.000 - 1.000 0.000 0.000
     5. Cubeful 2-ply    12/9 2/1                     Eq.: -1.000 (-0.001)
       0.000 0.000 0.000 - 1.000 0.000 0.000


Move number 36:  klara to play 31

 GNU Backgammon  Position ID: 220nAADLBwAAAA
                 Match ID   : EYGlAAAAEAAE
 +12-11-10--9--8--7-------6--5--4--3--2--1-+     O: klara
 |                  |   |       O     O  O | OO  0 points
 |                  |   |       O        O | OO  Rolled 31
 |                  |   |       O          | O   
 |                  |   |       O          | O   
 |                  |   |       O          | O  
^|                  |BAR|                  |     5 points match
 |                  |   |                  |    
 |                  |   |                  |     
 |                  |   | X        X       |     
 |                  |   | X  X  X  X  X  X |     
 |             X    |   | X  X  X  X  X  X |     2 points
 +13-14-15-16-17-18------19-20-21-22-23-24-+     X: lasse (Cube: 2)
Pip counts: O 24, X 59

* klara moves 4/off

Rolled 31:
*    1. Cubeful 2-ply    4/off                        Eq.: +0.999
       0.999 0.000 0.000 - 0.001 0.000 0.000
     2. Cubeful 2-ply    4/3 4/1                      Eq.: +0.999 (-0.000)
       0.999 0.000 0.000 - 0.001 0.000 0.000
     3. Cubeful 2-ply    4/1 2/1                      Eq.: +0.995 (-0.004)
       0.998 0.000 0.000 - 0.002 0.000 0.000


Move number 37:  lasse to play 41

 GNU Backgammon  Position ID: ywMAANttJwAAAA
                 Match ID   : UQmmAAAAEAAE
 +13-14-15-16-17-18------19-20-21-22-23-24-+     O: klara
 |                  |   |       O     O  O | OO  0 points
 |                  |   |       O        O | OO  
 |                  |   |       O          | OO  
 |                  |   |       O          | O   
 |                  |   |                  | O  
v|                  |BAR|                  |     5 points match
 |                  |   |                  |    
 |                  |   |                  |     
 |                  |   | X        X       |     
 |                  |   | X  X  X  X  X  X |     Rolled 41
 |             X    |   | X  X  X  X  X  X |     2 points
 +12-11-10--9--8--7-------6--5--4--3--2--1-+     X: lasse (Cube: 2)
Pip counts: O 20, X 59

* lasse moves 8/4 1/off

Cube analysis
2-ply cubeless equity -0.999 (Money: -0.999)
  0.001 0.000 0.000 - 0.999 0.000 0.000
Cubeful equities:
1. No double           -0.999
2. Double, pass        +1.000  (+1.999)
3. Double, take        -2.467  (-1.469)
Proper cube action: No redouble, take (42.4%)

Rolled 41:
*    1. Cubeful 2-ply    8/4 1/off                    Eq.: -1.000
       0.000 0.000 0.000 - 1.000 0.000 0.000
     2. Cubeful 2-ply    8/4 5/4                      Eq.: -1.000 (-0.000)
       0.000 0.000 0.000 - 1.000 0.000 0.000
     3. Cubeful 2-ply    8/4 6/5                      Eq.: -1.000 (-0.000)
       0.000 0.000 0.000 - 1.000 0.000 0.000
     4. Cubeful 2-ply    6/2 5/4                      Eq.: -1.000 (-0.000)
       0.000 0.000 0.000 - 1.000 0.000 0.000
     5. Cubeful 2-ply    8/4 3/2                      Eq.: -1.000 (-0.000)
       0.000 0.000 0.000 - 1.000 0.000 0.000


Move number 38:  klara to play 43

 GNU Backgammon  Position ID: 7W4HAIDlAQAAAA
                 Match ID   : EQGuAAAAEAAE
 +12-11-10--9--8--7-------6--5--4--3--2--1-+     O: klara
 |                  |   |       O     O  O | OO  0 points
 |                  |   |       O        O | OO  Rolled 43
 |                  |   |       O          | OO  
 |                  |   |       O          | O   
 |                  |   |                  | O  
^|                  |BAR|                  |     5 points match
 |                  |   |                  |    
 |                  |   |                  |     
 |                  |   | X     X  X       |     
 |                  |   | X  X  X  X  X    |     
 |                  |   | X  X  X  X  X  X | X   2 points
 +13-14-15-16-17-18------19-20-21-22-23-24-+     X: lasse (Cube: 2)
Pip counts: O 20, X 54

* klara moves 4/1 4/off

Rolled 43:
*    1. Cubeful 0-ply    4/1 4/off                    Eq.: +1.000
       1.000 0.000 0.000 - 0.000 0.000 0.000


Move number 39:  lasse to play 22

 GNU Backgammon  Position ID: lwEAgHa3AwAAAA
                 Match ID   : UQmpAAAAEAAE
 +13-14-15-16-17-18------19-20-21-22-23-24-+     O: klara
 |                  |   |       O     O  O | OO  0 points
 |                  |   |       O        O | OO  
 |                  |   |                O | OO  
 |                  |   |                  | OO  
 |                  |   |                  | O  
v|                  |BAR|                  |     5 points match
 |                  |   |                  |    
 |                  |   |                  |     
 |                  |   | X     X  X       |     
 |                  |   | X  X  X  X  X    |     Rolled 22
 |                  |   | X  X  X  X  X  X | X   2 points
 +12-11-10--9--8--7-------6--5--4--3--2--1-+     X: lasse (Cube: 2)
Pip counts: O 13, X 54

* lasse moves 4/off 2/off(2)

Cube analysis
2-ply cubeless equity -1.000 (Money: -1.000)
  0.000 0.000 0.000 - 1.000 0.000 0.000
Cubeful equities:
1. No double           -1.000
2. Double, pass        +1.000  (+2.000)
3. Double, take        -2.467  (-1.468)
Proper cube action: No redouble, take (42.3%)

Rolled 22:
     1. Cubeful 2-ply    6/4 5/3 2/off(2)             Eq.: -1.000
       0.000 0.000 0.000 - 1.000 0.000 0.000
*    2. Cubeful 2-ply    4/off 2/off(2)               Eq.: -1.000 (-0.000)
       0.000 0.000 0.000 - 1.000 0.000 0.000
     3. Cubeful 2-ply    5/3 4/off 2/off              Eq.: -1.000 (-0.000)
       0.000 0.000 0.000 - 1.000 0.000 0.000
     4. Cubeful 2-ply    5/3(2) 2/off(2)              Eq.: -1.000 (-0.000)
       0.000 0.000 0.000 - 1.000 0.000 0.000
     5. Cubeful 2-ply    6/4 3/1 2/off(2)             Eq.: -1.000 (-0.000)
       0.000 0.000 0.000 - 1.000 0.000 0.000


Move number 40:  klara to play 65

 GNU Backgammon  Position ID: ue0AAHAZAAAAAA
                 Match ID   : EQG3AAAAEAAE
 +12-11-10--9--8--7-------6--5--4--3--2--1-+     O: klara
 |                  |   |       O     O  O | OO  0 points
 |                  |   |       O        O | OO  Rolled 65
 |                  |   |                O | OO  
 |                  |   |                  | OO  
 |                  |   |                  | O  
^|                  |BAR|                  |     5 points match
 |                  |   |                  |    
 |                  |   |                  | X   
 |                  |   | X        X       | X   
 |                  |   | X  X  X  X       | X   
 |                  |   | X  X  X  X     X | X   2 points
 +13-14-15-16-17-18------19-20-21-22-23-24-+     X: lasse (Cube: 2)
Pip counts: O 13, X 46

* klara moves 4/off(2)

Rolled 65:
*    1. Cubeful 0-ply    4/off(2)                     Eq.: +1.000
       1.000 0.000 0.000 - 0.000 0.000 0.000


Move number 41:  lasse to play 43

 GNU Backgammon  Position ID: FwAAILcdAAAAAA
                 Match ID   : UQmuAAAAEAAE
 +13-14-15-16-17-18------19-20-21-22-23-24-+     O: klara
 |                  |   |             O  O | OOO 0 points
 |                  |   |                O | OO  
 |                  |   |                O | OO  
 |                  |   |                  | OO  
 |                  |   |                  | OO 
v|                  |BAR|                  |     5 points match
 |                  |   |                  |    
 |                  |   |                  | X   
 |                  |   | X        X       | X   
 |                  |   | X  X  X  X       | X   Rolled 43
 |                  |   | X  X  X  X     X | X   2 points
 +12-11-10--9--8--7-------6--5--4--3--2--1-+     X: lasse (Cube: 2)
Pip counts: O 5, X 46

* lasse moves 4/off 3/off

Cube analysis
2-ply cubeless equity -1.000 (Money: -1.000)
  -0.000 0.000 0.000 - 1.000 0.000 0.000
Cubeful equities:
1. No double           -1.000
2. Double, pass        +1.000  (+2.000)
3. Double, take        -2.467  (-1.467)
Proper cube action: No redouble, take (42.3%)

Rolled 43:
     1. Cubeful 2-ply    6/2 4/1                      Eq.: -1.000
       0.000 0.000 0.000 - 1.000 0.000 0.000
     2. Cubeful 2-ply    6/2 3/off                    Eq.: -1.000 (-0.000)
       0.000 0.000 0.000 - 1.000 0.000 0.000
     3. Cubeful 2-ply    6/3 5/1                      Eq.: -1.000 (-0.000)
       0.000 0.000 0.000 - 1.000 0.000 0.000
     4. Cubeful 2-ply    4/1 4/off                    Eq.: -1.000 (-0.000)
       0.000 0.000 0.000 - 1.000 0.000 0.000
     5. Cubeful 2-ply    5/1 4/1                      Eq.: -1.000 (-0.000)
       0.000 0.000 0.000 - 1.000 0.000 0.000
*    9. Cubeful 2-ply    4/off 3/off                  Eq.: -1.000 (-0.000)
       0.000 0.000 0.000 - 1.000 0.000 0.000


Move number 42:  klara to play 43

 GNU Backgammon  Position ID: WTsAAFwAAAAAAA
                 Match ID   : EQGuAAAAEAAE
 +12-11-10--9--8--7-------6--5--4--3--2--1-+     O: klara
 |                  |   |             O  O | OOO 0 points
 |                  |   |                O | OO  Rolled 43
 |                  |   |                O | OO  
 |                  |   |                  | OO  
 |                  |   |                  | OO 
^|                  |BAR|                  |     5 points match
 |                  |   |                  | X  
 |                  |   |                  | X   
 |                  |   | X                | X   
 |                  |   | X  X     X       | X   
 |                  |   | X  X  X  X     X | XX  2 points
 +13-14-15-16-17-18------19-20-21-22-23-24-+     X: lasse (Cube: 2)
Pip counts: O 5, X 39

* klara moves 2/off 1/off

Rolled 43:
*    1. Cubeful 0-ply    2/off 1/off                  Eq.: +1.000
       1.000 0.000 0.000 - 0.000 0.000 0.000


Move number 43:  lasse to play 32

 GNU Backgammon  Position ID: AwAAyNoBAAAAAA
                 Match ID   : UYmpAAAAEAAE
 +13-14-15-16-17-18------19-20-21-22-23-24-+     O: klara
 |                  |   |                O | OOO 0 points
 |                  |   |                O | OOO 
 |                  |   |                  | OOO 
 |                  |   |                  | OO  
 |                  |   |                  | OO 
v|                  |BAR|                  |     5 points match
 |                  |   |                  | X  
 |                  |   |                  | X   
 |                  |   | X                | X   
 |                  |   | X  X     X       | X   Rolled 32
 |                  |   | X  X  X  X     X | XX  2 points
 +12-11-10--9--8--7-------6--5--4--3--2--1-+     X: lasse (Cube: 2)
Pip counts: O 2, X 39

* lasse moves 6/4 3/off

Cube analysis
2-ply cubeless equity -1.000 (Money: -1.000)
  -0.000 0.000 0.000 - 1.000 0.000 0.000
Cubeful equities:
1. No double           -1.000
2. Double, pass        +1.000  (+2.000)
3. Double, take        -2.467  (-1.467)
Proper cube action: No redouble, take (42.3%)

Rolled 32:
     1. Cubeful 2-ply    6/3 4/2                      Eq.: -1.000
       0.000 0.000 0.000 - 1.000 0.000 0.000
     2. Cubeful 2-ply    6/1                          Eq.: -1.000 (-0.000)
       0.000 0.000 0.000 - 1.000 0.000 0.000
     3. Cubeful 2-ply    6/4 5/2                      Eq.: -1.000 (-0.000)
       0.000 0.000 0.000 - 1.000 0.000 0.000
     4. Cubeful 2-ply    5/3 5/2                      Eq.: -1.000 (-0.000)
       0.000 0.000 0.000 - 1.000 0.000 0.000
     5. Cubeful 2-ply    5/2 4/2                      Eq.: -1.000 (-0.000)
       0.000 0.000 0.000 - 1.000 0.000 0.000
*   12. Cubeful 2-ply    6/4 3/off                    Eq.: -1.000 (-0.000)
       0.000 0.000 0.000 - 1.000 0.000 0.000


Move number 44:  klara to play 62

 GNU Backgammon  Position ID: aRsAAAYAAAAAAA
                 Match ID   : EQGrAAAAEAAE
 +12-11-10--9--8--7-------6--5--4--3--2--1-+     O: klara
 |                  |   |                O | OOO 0 points
 |                  |   |                O | OOO Rolled 62
 |                  |   |                  | OOO 
 |                  |   |                  | OO  
 |                  |   |                  | OO 
^|                  |BAR|                  |     5 points match
 |                  |   |                  | X  
 |                  |   |                  | X   
 |                  |   |                  | X   
 |                  |   | X  X  X          | XX  
 |                  |   | X  X  X  X     X | XX  2 points
 +13-14-15-16-17-18------19-20-21-22-23-24-+     X: lasse (Cube: 2)
Pip counts: O 2, X 34

* klara moves 1/off(2)

Rolled 62:
*    1. Cubeful 0-ply    1/off(2)                     Eq.: +1.000
       1.000 0.000 0.000 - 0.000 0.000 0.000


klara wins 2 points

Game statistics for game 2

Player                                   klara                   lasse                  

Chequerplay statistics

Total moves                               21                      21                    
Unforced moves                            16                      20                    
Unmarked moves                            20                      18                    
Moves marked doubtful                      0                       0                    
Moves marked bad                           0                       2                    
Moves marked very bad                      1                       1                    
Error total EMG (MWC)                         -0.166 ( -1.431%)       -0.395 ( -3.880%) 
Error rate mEMG (MWC)                        -10.4   ( -0.089%)      -19.8   ( -0.194%) 
Chequerplay rating                       Advanced                Casual player          


Cube statistics

Total cube decisions                       7                      21                    
Close or actual cube decisions             5                       1                    
Doubles                                    1                       0                    
Takes                                      0                       1                    
Passes                                     0                       0                    
Missed doubles below CP (EMG (MWC))        0                       0                    
Missed doubles above CP (EMG (MWC))        0                       0                    
Wrong doubles below DP (EMG (MWC))         0                       0                    
Wrong doubles above TG (EMG (MWC))         0                       0                    
Wrong takes (EMG (MWC))                    0                       0                    
Wrong passes (EMG (MWC))                   0                       0                    
Error total EMG (MWC)                         -0.000 ( -0.000%)       -0.000 ( -0.000%) 
Error rate mEMG (MWC)                         -0.0   ( -0.000%)       -0.0   ( -0.000%) 
Cube decision rating                     Supernatural            Supernatural           


Overall statistics

Error total EMG (MWC)                         -0.166 ( -1.431%)       -0.395 ( -3.880%) 
Error rate mEMG (MWC)                         -7.9   ( -0.068%)      -18.8   ( -0.185%) 
Snowie error rate                             -4.0   ( +0.000%)       -9.4   ( +0.000%) 
Overall rating                           Expert                  Casual player          
Error based abs. FIBS rating             1905.5                  1775.4                 
Chequerplay errors rating loss            144.5                   274.6                 
Cube errors rating loss                     0.0                     0.0                 




Output generated Tue Oct 10 09:08:00 2023
 by GNU Backgammon 1.07.001-mingw 32-Bit 20221114 (Text Export version 1.128)

